Tweet_ID,Raw_text,Cleaned_text,Created_at,Sentiment,Annotation
4.6489E+17,#thinspo #thinspiration #fitspo http://t.co/dtfC3bLDmY,thin spo inspiration fits po,5/9/2014 22:11:01,0.401146,Other
4.6489E+17,#thinspo #thinspiration http://t.co/grlPYPkODn,thin spo inspiration,5/9/2014 22:11:13,0,Other
4.64892E+17,@Iam_ROMAN_ go live your own life.,live life,5/9/2014 22:16:42,0,Other
4.64893E+17,@Iam_ROMAN_ well I'm really not interested,interested,5/9/2014 22:21:44,-0.598939,S1_little_interest
4.65021E+17,one month and my exams are all over and I can exercise all day every day,month exams exercise day day,5/10/2014 6:49:22,-0.441288,Other
4.65192E+17,off to my friends tonight so I pretended I was having dinner round hers,friends tonight pretended dinner,5/10/2014 18:08:24,-0.509033,S5_Eating_Disorder
4.65192E+17,should have lost so much weight this weekend,lost weight weekend,5/10/2014 18:10:54,-0.86208,Other
4.65286E+17,need to get up so early to go to the gym in the morning,gym morning,5/11/2014 0:22:31,-0.530512,S5_Eating_Disorder
4.65494E+17,"I hate being home all day when my parents are home 
they make me eat",hate day parents eat,5/11/2014 14:07:58,-0.8643,S5_Eating_Disorder
4.65527E+17,make excuses not to eat every single day,excuses eat single day,5/11/2014 16:19:09,-0.691464,S5_Eating_Disorder
4.65527E+17,just want to be skinny,skinny,5/11/2014 16:19:27,-0.379086,S6_Feeling_Bad_About_Yourself
4.65527E+17,mum says I need to eat for my exams but no,mum eat exams,5/11/2014 16:19:45,-0.703744,S5_Eating_Disorder
4.65527E+17,done so much psychology revision today,psychology revision,5/11/2014 16:20:34,-0.655488,Other
4.65527E+17,"thigh gaps don't matter'
well that's nice, they matter to me",gaps matter nice matter,5/11/2014 16:21:19,0.177139,S6_Feeling_Bad_About_Yourself
4.65527E+17,how nice would it be to accept your body for what it is,nice accept body,5/11/2014 16:21:46,0.821789,Other
4.65528E+17,going out for dinner after exams and I'm already dreading it,dinner exams dreading,5/11/2014 16:23:20,-0.759913,S5_Eating_Disorder
4.65528E+17,some people are so bitchy,people bitchy,5/11/2014 16:24:01,-0.384549,Other
4.65528E+17,you make me so far beyond angry,angry,5/11/2014 16:24:13,-0.7112,Other
4.65528E+17,I want my boyfriend here,boyfriend,5/11/2014 16:24:56,-0.257504,Other
4.65528E+17,I wish exercising didn't take up so much of my day,exercising day,5/11/2014 16:25:57,-0.634265,Other
4.65529E+17,so excited to move out,excited move,5/11/2014 16:27:13,0.774047,Other
4.65529E+17,in the summer i'm going to the gym everyday,summer gym everyday,5/11/2014 16:27:52,0.650915,Other
4.65529E+17,my boyfriend knows how bad my depression has got again,boyfriend bad depression,5/11/2014 16:28:16,-0.842615,Other
4.65529E+17,I feel sorry for him,feel,5/11/2014 16:28:22,-0.886464,Other
4.65529E+17,how good would it be to enjoy life,good enjoy life,5/11/2014 16:29:02,0.629643,S2_Feeling_Down
4.65529E+17,I want to lose weight quicker,lose weight quicker,5/11/2014 16:30:04,-0.773282,Other
4.65529E+17,everything is worse when i'm stressed out,worse stressed,5/11/2014 16:30:34,-0.878408,S6_Feeling_Bad_About_Yourself
4.65564E+17,@fattttyyyy1 would be so perfect!,perfect,5/11/2014 18:49:08,0.754223,Other
4.65614E+17,"@fattttyyyy1 you can get there, you will be able to do it!xxx",xxx,5/11/2014 22:05:07,0.408053,Other
4.65618E+17,"@fattttyyyy1 just believe in yourself, you can do it 😘 xxx",xxx,5/11/2014 22:21:00,0.458655,Other
4.65618E+17,RT @lmlosingmyself: Someone should starve me thin,starve thin,5/11/2014 22:21:06,-0.824205,S5_Eating_Disorder
4.65618E+17,I'm so scared you'll find someone who's better,scared 'll find,5/11/2014 22:21:50,-0.764476,S6_Feeling_Bad_About_Yourself
4.65618E+17,"@fattttyyyy1 thank you! and you too, feel free to dm any time xxxx",feel free dm time xxxx,5/11/2014 22:22:34,0.887895,Other
4.65816E+17,haven't binged in so long until now,binge,5/12/2014 11:29:20,-0.264314,Other
4.65816E+17,now I just have to exercise it off instead of revising,exercise revising,5/12/2014 11:29:43,-0.806281,Other
4.65969E+17,I'm so so disgusting,disgusting,5/12/2014 21:37:38,-0.723993,S6_Feeling_Bad_About_Yourself
4.65969E+17,feel like it's one step forward and two steps back all the time,feel step forward steps time,5/12/2014 21:38:13,0.676198,S2_Feeling_Down
4.65976E+17,been looking through attractive people's instagrams all night and it's killing me,attractive people insta grams night killing,5/12/2014 22:06:03,-0.434491,Other
4.65976E+17,RT @mysavioursrbvb: They said it gets easier but they lied,easier lied,5/12/2014 22:06:18,-0.671383,Other
4.65977E+17,"so weird binging again today, I don't think it'll happen again",weird binging happen,5/12/2014 22:07:16,-0.861737,Other
4.65977E+17,"RT @darlingsaveme: I'll have a shot of bleach, please. Actually, make that 4.",shot bleach,5/12/2014 22:09:56,-0.0835754,S9_Suicidal_Thoughts
4.65977E+17,"need to lose 4lb this week, someone please help",lose 4lb week,5/12/2014 22:10:29,-0.68769,Other
4.65978E+17,@_INeedLoveOh_ thank you!!! I do need to though,,5/12/2014 22:14:56,0.192904,Other
4.6598E+17,I just need to be noticeably skinnier to go on holiday,noticeably skinnier holiday,5/12/2014 22:21:45,-0.715077,S6_Feeling_Bad_About_Yourself
4.6598E+17,@_INeedLoveOh_ I really do! Trust me!,trust,5/12/2014 22:22:07,0.719672,Other
4.65981E+17,@_INeedLoveOh_ I'm just happier skinnier,happier skinnier,5/12/2014 22:23:35,0.569399,S5_Eating_Disorder
4.65981E+17,@_INeedLoveOh_ just don't make yourself miserable,miserable,5/12/2014 22:24:23,-0.766394,Other
4.65981E+17,my best friend found out about this account,friend account,5/12/2014 22:25:59,0.678612,Other
4.65981E+17,turns out she has one too,turns,5/12/2014 22:26:16,0,Other
4.65981E+17,"she said she might follow me
so asked what my account was called",follow asked account called,5/12/2014 22:26:45,-0.385093,Other
4.65981E+17,I wish I had the guts to tell her what it is,guts,5/12/2014 22:26:59,-0.422237,S6_Feeling_Bad_About_Yourself
4.65982E+17,but I couldn't let her see me on here,,5/12/2014 22:27:14,-0.64875,Other
4.65982E+17,not when she thinks we're recovering together,thinks recovering,5/12/2014 22:27:27,-0.561288,Other
4.65982E+17,I know I'd trigger her to start restricting again,trigger start restricting,5/12/2014 22:29:44,-0.686485,Other
4.65982E+17,"@StuckCounting yeah best friends for like 7 years now and her ED only started a year a go, so ask away",yeah friends years started year,5/12/2014 22:30:56,0.384441,Other
4.65985E+17,"@StuckCounting you have an ED yourself? Deal with it how you'd want to be treated, don't be insensitive but also don't tiptoe around her (c)",deal 'd treated insensitive tiptoe,5/12/2014 22:41:38,0,Other
4.65985E+17,"@StuckCounting (c) my best friend didn't know about me at first &amp; I found it really hard &amp; never knew what to say, but just act normally (c)",friend amp amp knew,5/12/2014 22:42:34,0,Other
4.65986E+17,"@StuckCounting (c) and don't act like there's something massive wrong with it, try to talk to her gently and just see how she takes it",massive wrong talk gently takes,5/12/2014 22:43:06,-0.224033,Other
4.65986E+17,"""thigh gaps and collarbones aren't attractive"" hell yeah they are",thigh gaps collar bones attractive hell yeah,5/12/2014 22:44:06,-0.558349,Other
4.65986E+17,you're bullshitting if you say that,bullshitting,5/12/2014 22:44:17,-0.374701,Other
4.65986E+17,there's food porn on my timeline ugh,food porn timeline ugh,5/12/2014 22:45:11,-0.873359,Other
4.65988E+17,@StuckCounting ultimately you need to focus on yourself and just let her know that you're there for her bc just knowing that will help (c),ultimately focus bc knowing,5/12/2014 22:54:39,0.316934,Other
4.65989E+17,@StuckCounting (c) and make sure she knows that you know that really she is still struggling BUT BE A LITTLE SELFISH AND FOCUS ON YOU PLEASE,struggling selfish focus,5/12/2014 22:55:29,-0.612597,Other
4.65989E+17,I can't seem to lose weight fast enough,lose weight fast,5/12/2014 22:56:13,-0.787978,Other
4.65989E+17,my best friend made me relapse &amp; I know she feels bad for it,friend relapse amp feels bad,5/12/2014 22:58:24,-0.732085,Other
4.65989E+17,compulsive exerciser,compulsive exerciser,5/12/2014 22:58:35,0,Other
4.6599E+17,"@StuckCounting I know the feeling! Just do what feels right but don't get TOO involved, I think we all hate it, ily 😘",feeling feels involved hate ily,5/12/2014 22:59:22,-0.605982,Other
4.6599E+17,mum won't let me cook dinner until my exams are over in a month and I'm so anxious &amp; can't sleep,mum cook dinner exams month anxious amp sleep,5/12/2014 23:00:55,-0.649096,S3_Sleep_Disorder
4.6599E+17,kind if wish my exams were sooner so they could just be over,kind exams sooner,5/12/2014 23:01:48,0,Other
4.65991E+17,"@StuckCounting I was the same, she triggered me so much, try not to trigger your friend! I'm trying to but I just don't want to recover rn",triggered trigger friend recover rn,5/12/2014 23:03:49,-0.519621,Other
4.65991E+17,RT @ImFrxgile: ignore :) me :) then :),ignore,5/12/2014 23:04:05,-0.701953,Other
4.65993E+17,"@StuckCounting that's good I guess, but don't bottle it up too much",good guess bottle,5/12/2014 23:12:55,-0.579961,Other
4.65993E+17,@StuckCounting thank you 💜 and so do you 💕,,5/12/2014 23:13:20,0.774893,Other
4.65994E+17,"RT @mysavioursrbvb: Vic's voice is perfect 

Shut up 

You're opinion is wrong",vic's voice perfect shut opinion wrong,5/12/2014 23:14:47,-0.0936529,Other
4.65994E+17,"@StuckCounting that's definitely why I'm on here, hugs and kisses 😘💕",hugs kisses,5/12/2014 23:15:40,0.417008,Other
4.65994E+17,"I just hope one day, we can meet in the middle",hope day meet middle,5/12/2014 23:16:36,0.540121,Other
4.65995E+17,@StuckCounting thank you so much 💕 and I'm always here for you,,5/12/2014 23:19:03,0.793918,Other
4.65997E+17,sometimes I try to bleed the fat out,bleed fat,5/12/2014 23:29:23,-0.756978,S6_Feeling_Bad_About_Yourself
4.65998E+17,gonna have to make an ana tumblr,tum blr,5/12/2014 23:33:30,0.227131,Other
4.66001E+17,how am I suppose to revise on four hours sleep a night,suppose revise hours sleep night,5/12/2014 23:42:36,-0.773136,S3_Sleep_Disorder
4.66001E+17,massive shopping spree when I reach my goal weight,massive shopping spree reach goal weight,5/12/2014 23:45:16,-0.661028,Other
4.66005E+17,@amcilwaine it will get better,,5/12/2014 23:59:25,0.426787,Other
4.66116E+17,"@amcilwaine thanks, me too xx",xx,5/13/2014 7:20:15,0.779519,Other
4.66238E+17,until I go on holiday my net calories will be under 100 everyday,holiday net calories 100 everyday,5/13/2014 15:28:02,0,S5_Eating_Disorder
4.66329E+17,weigh more than I thought I did ffs,weigh thought ffs,5/13/2014 21:29:04,-0.365963,S6_Feeling_Bad_About_Yourself
4.6633E+17,how nice would it be to be happy &amp; confident though,nice happy amp confident,5/13/2014 21:32:24,0.867155,S2_Feeling_Down
4.6633E+17,ana hates me,hates,5/13/2014 21:33:20,-0.828782,Other
4.6633E+17,I won't even let my boyfriend touch me,boyfriend touch,5/13/2014 21:33:43,-0.755274,Other
4.66331E+17,@suicxdevibes 💕💕,,5/13/2014 21:35:10,0,Other
4.66332E+17,@anxietytolose can't stand it,stand,5/13/2014 21:40:51,-0.669708,Other
4.66335E+17,I have so much holiday thinspo saved,holiday thin spo saved,5/13/2014 21:50:42,0,Other
4.66693E+17,need to lose 8492917 lbs,lose 8492917 lbs,5/14/2014 21:33:34,-0.528825,S5_Eating_Disorder
4.66693E+17,so glad I can now fast,glad fast,5/14/2014 21:33:58,0.666716,S5_Eating_Disorder
4.66693E+17,"can't stop thinking that so long as I have to eat dinner I won't lose weight 
but no no that's not true",thinking eat dinner lose weight,5/14/2014 21:34:36,-0.339936,S5_Eating_Disorder
4.66693E+17,my parents don't need to diet yet they do &amp; I'm supposed to not care about calories?,parents diet amp supposed care calories,5/14/2014 21:35:22,-0.778817,Other
4.66693E+17,RT @brokenxwingss: i dont fucking get you,dont fucking,5/14/2014 21:35:43,-0.774628,Other
4.66693E+17,RT @BodyIssues234: Can we just fast forward to when I start living on my own??,fast forward start,5/14/2014 21:35:46,0.445507,Other
4.66693E+17,RT @iwantto_bethin: today i saw a girl with such skinny legs. that made me so depressed. i wish i was thinner,girl skinny legs depressed thinner,5/14/2014 21:36:01,-0.897675,S6_Feeling_Bad_About_Yourself
4.66696E+17,someone please help me loose weight quicker,loose weight quicker,5/14/2014 21:44:24,-0.702675,Other
4.66697E+17,@GlupiaNazwa1 please,,5/14/2014 21:50:35,-0.272029,Other
4.66698E+17,@GlupiaNazwa1 yes it will be :) message me if you need to!,message,5/14/2014 21:53:38,0.727845,Other
4.66703E+17,RT @marked_skin: Why did I wake up?,wake,5/14/2014 22:14:52,-0.633168,S2_Feeling_Down
4.66703E+17,miss my boyfriend,boyfriend,5/14/2014 22:15:15,-0.846841,Other
4.66704E+17,"you don't know what it's like
to wake up in the middle of the night
scaring the thought of kissing razors",wake middle nights caring thought kissing razors,5/14/2014 22:17:16,-0.0607918,S9_Suicidal_Thoughts
4.66704E+17,Pierce The Veil // Stay Away from My Friend,pierce veil stay friend,5/14/2014 22:19:06,0,Other
4.66956E+17,I cant stand to be this fat anymore,stand fat,5/15/2014 15:00:54,-0.913701,S6_Feeling_Bad_About_Yourself
4.67003E+17,I don't want to be like this anymore,,5/15/2014 18:06:36,-0.776321,Other
4.67003E+17,I don't want cutting to be the only reason I'm still here,cutting reason,5/15/2014 18:06:56,-0.495014,S9_Suicidal_Thoughts
4.67003E+17,I don't understand the point of life,understand point life,5/15/2014 18:07:13,-0.485934,S9_Suicidal_Thoughts
4.67007E+17,It won't stop bleeding,bleeding,5/15/2014 18:21:04,-0.310176,Other
4.67007E+17,I'm through with pretending to be happy,pretending happy,5/15/2014 18:22:06,-0.513178,S2_Feeling_Down
4.6701E+17,@_XKidnapped yeah,yeah,5/15/2014 18:33:22,0,Other
4.6701E+17,@_XKidnapped eventually,eventually,5/15/2014 18:35:24,-0.298307,Other
4.67011E+17,@_XKidnapped you too &lt;3,lt3,5/15/2014 18:37:40,0.444623,Other
4.67379E+17,ugh my boyfriend made me eat so much dinner,ugh boyfriend eat dinner,5/16/2014 19:02:01,-0.852894,S5_Eating_Disorder
4.67386E+17,"want a drumstick lolly but oh wait 
hey ana",drumstick lolly wait hey,5/16/2014 19:27:38,0.54767,S5_Eating_Disorder
4.67387E+17,@GlupiaNazwa1 exactly! definitely not having it! :),,5/16/2014 19:33:23,0.129792,Other
4.67749E+17,"I'm going on holiday w/ my boyf's family, I will have to eat &amp; won't have much chance to exercise, what do I do?!",holiday boyf's family eat amp chance exercise,5/17/2014 19:31:17,0.345596,S5_Eating_Disorder
4.67927E+17,lost more weight,lost weight,5/18/2014 7:19:25,-0.819535,Other
4.68056E+17,I'm so horrible &amp; fat,horrible amp fat,5/18/2014 15:49:31,-0.888128,S6_Feeling_Bad_About_Yourself
4.68471E+17,@skinnydiary34 🙌,,5/19/2014 19:18:33,0,Other
4.68472E+17,@skinnydiary34 that's what my parents are like &amp; I'm like well I don't have to eat...,parents amp eat,5/19/2014 19:23:42,0,S5_Eating_Disorder
4.68479E+17,"@skinnydiary34 me too, they're pretty much asking for it",y're pretty,5/19/2014 19:50:02,0.66562,Other
4.68483E+17,I need to lose weight for holiday but it's come at the worst time bc exams,lose weight holiday worst time bc exams,5/19/2014 20:06:00,-0.869197,S2_Feeling_Down
4.68518E+17,@blxckminded sure I'll post some now,post,5/19/2014 22:26:04,0,Other
4.68519E+17,@blxckminded #thinspo #thinspiration #summer #holiday http://t.co/oZANBA95VK,thin spo inspiration summer holiday,5/19/2014 22:28:19,0.510898,Other
4.68519E+17,@blxckminded #thinspo #thinspiration #summer #holiday #beach http://t.co/bGpirnV0kU,thin spo inspiration summer holiday beach,5/19/2014 22:29:08,0.601987,Other
4.68519E+17,@blxckminded #thinspo http://t.co/2Ci7Scw3M3,thin spo,5/19/2014 22:30:09,-0.407737,Other
4.68519E+17,@allyourmonsters 💕💕💕,,5/19/2014 22:31:43,0,Other
4.6852E+17,@w4stelandofh0pe pls dm me if you need to talk about it 💕,pls dm talk,5/19/2014 22:34:16,0.277617,Other
4.68521E+17,"someone please help, is 15lb in a month possible (considering I can't just fast all the time bc parents)",15lb month fast time bc parents,5/19/2014 22:36:10,-0.521817,S5_Eating_Disorder
4.68521E+17,@DemiGagaJensen my parents stopped commenting on portion sizes but now they're getting more annoying about it,parents stopped commenting portion sizes y're annoying,5/19/2014 22:38:26,-0.744754,S5_Eating_Disorder
4.68521E+17,"@w4stelandofh0pe ok well whenever is fine, you don't deserve someone to treat you bad! ily ❤️❤️",fine deserve treat bad ily,5/19/2014 22:39:27,0,Other
4.68522E+17,"RT @cut_wrists: I kinda wish this was real, but I'd still be ugly so idk anymore http://t.co/YvYdE276Xl",kinda ugly idk,5/19/2014 22:40:51,-0.917985,S6_Feeling_Bad_About_Yourself
4.68522E+17,RT @22toofat: I hate my body,hate body,5/19/2014 22:41:52,-0.88718,S6_Feeling_Bad_About_Yourself
4.68523E+17,I was so much happier when I hit my goal weight before &amp; then recovery happened &amp; wasted so so much time,happier hit goal weight amp recovery happened amp wasted time,5/19/2014 22:44:48,-0.856817,S5_Eating_Disorder
4.68525E+17,@DemiGagaJensen they really don't,,5/19/2014 22:53:48,-0.630807,Other
4.68775E+17,"ugh mum's taking me out for dinner, it so ungrateful but I don't want to go",ugh mum's dinner ungrateful,5/20/2014 15:28:19,-0.835668,S5_Eating_Disorder
4.68776E+17,RT @Worthless_Bitxh: I got to my goal weight. Then I started eating. So my weight went up again. Fuck.,goal weight started eating weight fuck,5/20/2014 15:29:42,-0.384974,S5_Eating_Disorder
4.68879E+17,thigh gap is back,thigh gap,5/20/2014 22:19:30,0,Other
4.69227E+17,Only having 300 calories for the next five days,300 calories days,5/21/2014 21:25:28,-0.646863,S5_Eating_Disorder
4.69952E+17,RT @fatfailure_me: I'm sick of looking at my body in the mirror,sick body mirror,5/23/2014 21:22:39,-0.783829,S6_Feeling_Bad_About_Yourself
4.69952E+17,eaten nothing for two days thank god,eaten days god,5/23/2014 21:23:44,0.372857,S5_Eating_Disorder
4.69952E+17,my head is such a mess right now,head mess,5/23/2014 21:25:38,-0.843822,S7_Concentration_Problems
4.69953E+17,can't believe I've finished school for good,finished school good,5/23/2014 21:28:05,-0.514262,Other
4.69953E+17,why can't I be pretty,pretty,5/23/2014 21:29:06,-0.71631,S6_Feeling_Bad_About_Yourself
4.69954E+17,I wanna lose weight and go clothes shopping,lose weight clothes shopping,5/23/2014 21:30:59,-0.74548,Other
4.69955E+17,@ExtremeSweet45 you wouldn't say that if you saw me,,5/23/2014 21:37:48,-0.362149,S5_Eating_Disorder
4.701E+17,Hmm how to avoid dinner..,hmm avoid dinner,5/24/2014 7:11:05,-0.568915,S5_Eating_Disorder
4.701E+17,"managed to get out of dinner for the last three days, don't think I can skip again",managed dinner days skip,5/24/2014 7:11:43,-0.717052,S5_Eating_Disorder
4.70101E+17,"I've lost my voice, like completely lost my voice",lost voice completely lost voice,5/24/2014 7:16:37,-0.883792,Other
4.70196E+17,I hate work but at least I can skip work without being screamed at for it,hate work skip work screamed,5/24/2014 13:32:52,-0.916141,Other
4.70196E+17,I'm so dizzy I have no idea what's happening,dizzy idea happening,5/24/2014 13:33:20,-0.826238,Other
4.70475E+17,I can't ever eat again,eat,5/25/2014 8:02:35,-0.747929,S5_Eating_Disorder
4.70475E+17,my whole life is just one big panic attack at the momen,life big panic attack momen,5/25/2014 8:02:58,-0.655567,S2_Feeling_Down
4.70475E+17,just told my boyfriend that I can't do it anymore,told boyfriend,5/25/2014 8:03:16,-0.803268,Other
4.70475E+17,can't do any of it anymore,,5/25/2014 8:03:26,-0.819796,Other
4.70497E+17,RT @Fatuglyew: I'm so done rn,rn,5/25/2014 9:29:14,0.464179,Other
4.70497E+17,I don't want to be here anymore,,5/25/2014 9:29:34,-0.769467,Other
4.70497E+17,I'm just done,,5/25/2014 9:29:48,0,Other
4.70497E+17,I'm so sick of pretending now,sick pretending,5/25/2014 9:30:01,-0.902802,Other
4.70497E+17,"I'm not fine. 
I haven't been fine for four and a half years now. 
And I'm not taking it anymore",fine fine half years,5/25/2014 9:30:44,-0.581718,S2_Feeling_Down
4.70497E+17,@Brokendream19 no one ever really listens,listens,5/25/2014 9:31:07,-0.504331,S2_Feeling_Down
4.70498E+17,in the end we all die so what's the point of this middle bit called life,die point middle bit called life,5/25/2014 9:32:25,-0.332995,S9_Suicidal_Thoughts
4.70498E+17,RT @Anorexic_95: Dont give up beautiful http://t.co/184umTgYEm,dont beautiful,5/25/2014 9:33:06,-0.270317,Other
4.70498E+17,"@Brokendream19 I think I'm through with talking now anyway, it doesn't change anything",talking change,5/25/2014 9:33:58,-0.35163,Other
4.70499E+17,RT @xnobody_x: Nobody cares so,cares,5/25/2014 9:37:41,-0.747814,S1_little_interest
4.70505E+17,RT @imnot0kay_: words can't describe how much i miss the feeling of blood running down my wrist,describe feeling blood running wrist,5/25/2014 10:01:08,-0.949859,S9_Suicidal_Thoughts
4.70505E+17,I'm gonna cut,cut,5/25/2014 10:01:19,0,S9_Suicidal_Thoughts
4.70505E+17,RT @imnot0kay_: Admit it... http://t.co/cFkPxL3OpM,admit,5/25/2014 10:02:18,0.314213,Other
4.70505E+17,need to study but I just can't,study,5/25/2014 10:02:36,-0.752794,Other
4.7096E+17,RT @shattered_roses: I'm a hypocrite. http://t.co/NCviGeDPky,hypocrite,5/26/2014 16:11:44,-0.705692,S6_Feeling_Bad_About_Yourself
4.71004E+17,I feel so fat,feel fat,5/26/2014 19:03:49,-0.689177,S6_Feeling_Bad_About_Yourself
4.71004E+17,ffs,ffs,5/26/2014 19:03:52,-0.357392,Other
4.71004E+17,told mum I can't do 'family time' bc I have to revise but now I want to exercise and cant fgs,told mum family time bc revise exercise fgs,5/26/2014 19:04:31,-0.834762,Other
4.71004E+17,I will always be fat,fat,5/26/2014 19:05:20,-0.303647,S6_Feeling_Bad_About_Yourself
4.71004E+17,some things will never change,things change,5/26/2014 19:05:44,-0.302421,Other
4.71004E+17,so bitter towards my best friend,bitter friend,5/26/2014 19:06:10,-0.763535,Other
4.71004E+17,she hurt me &amp; inside I will never forgive her for that,hurt amp forgive,5/26/2014 19:06:27,-0.745367,Other
4.71005E+17,she went too far,,5/26/2014 19:06:40,-0.284297,Other
4.71005E+17,and she can be such a horrible person sometimes,horrible person,5/26/2014 19:06:57,-0.811639,Other
4.71005E+17,she can manipulate anyone and everyone to be on her side,manipulate side,5/26/2014 19:07:18,0,Other
4.71005E+17,fingers crossed she'll never read this,fingers crossed read,5/26/2014 19:07:38,-0.420341,Other
4.71016E+17,hate exams bc no Netflix,hate exams bc netflix,5/26/2014 19:51:56,-0.843126,Other
4.71016E+17,RT @whystayalive_: bands,bands,5/26/2014 19:52:30,0,S9_Suicidal_Thoughts
4.71016E+17,"I give 2nd chances too easily
And then 3rd &amp; 4th &amp; 5th chances",2nd chances easily 3rd amp 4th amp 5th chances,5/26/2014 19:53:30,0.479557,Other
4.7104E+17,almost cheated on my boyfriend the other day and I think he knows,cheated boyfriend day,5/26/2014 21:26:04,-0.621617,Other
4.7104E+17,I feel so so sick,feel sick,5/26/2014 21:26:20,-0.875275,S6_Feeling_Bad_About_Yourself
4.7104E+17,I wish he'd jut reply,jut reply,5/26/2014 21:26:30,0,Other
4.71253E+17,think I really fucked it up with my boyfriend this time,fucked boyfriend time,5/27/2014 11:35:28,-0.847971,Other
4.71253E+17,I've never been so scared,scared,5/27/2014 11:35:50,-0.735703,S7_Concentration_Problems
4.71658E+17,wish I could go to the gym after dinner more often,gym dinner,5/28/2014 14:21:55,-0.325715,Other
4.71658E+17,feels more worth it after dinner,feels worth dinner,5/28/2014 14:22:05,0,Other
4.71658E+17,otherwise I feel like the calories I burn are just empty and don't contribute towards my net,feel calories burn empty contribute net,5/28/2014 14:22:33,-0.818759,Other
4.71658E+17,"im back to having to weigh myself every morning, during the day and again at night ffs I thought this had stopped",weigh morning day night ffs thought stopped,5/28/2014 14:23:33,-0.390189,S5_Eating_Disorder
4.71658E+17,"thought I was doing well
id managed to fool myself",thought managed fool,5/28/2014 14:23:48,-0.520403,S6_Feeling_Bad_About_Yourself
4.71658E+17,I am just ew,ew,5/28/2014 14:23:54,-0.731057,S6_Feeling_Bad_About_Yourself
4.71658E+17,cant look at myself in the mirror anymore,mirror,5/28/2014 14:24:10,-0.829312,S6_Feeling_Bad_About_Yourself
4.71658E+17,"the more weight I lose
the worse things get",weight lose worse things,5/28/2014 14:24:26,-0.775903,S5_Eating_Disorder
4.71658E+17,but that just won't stop me,,5/28/2014 14:24:38,-0.462851,Other
4.71749E+17,so excited for my tattoo tomorrow,excited tattoo tomorrow,5/28/2014 20:26:53,0.818048,Other
4.71761E+17,"@stared909 it's my own design but it's an sort of circular with detail in it, it's going between my shoulder blades",design sort circular detail shoulder blades,5/28/2014 21:11:18,0,Other
4.71772E+17,@stared909 are you not old enough? I'm already planning my next ones 🙊 wrist and then full thigh piece 🙈🙈,planning wrist full thigh piece,5/28/2014 21:55:52,-0.542868,Other
4.71773E+17,"@stared909 ah ok! I wasn't allowed until I was 18! I'm so excited &amp; yeah they're dead cute, that's the kind of thing I want x",allowed 18 excited amp yeah y're dead cute kind thing,5/28/2014 22:00:08,0.239492,Other
4.71774E+17,@stared909 aha well I'll keep my fingers crossed for you! I think I will do haha then you can see it for real! x,aha fingers crossed haha,5/28/2014 22:04:28,0.837174,Other
4.71775E+17,"@stared909 ah not too long now! oh that really sucks, I'm on study leave so kind of lucky x",sucks study leave kind lucky,5/28/2014 22:07:53,-0.811076,Other
