Tweet_ID,Raw_text,Cleaned_text,Created_at,Sentiment,Annotation
5.01827E+17,I'm so fat this is killing me,fat killing,8/19/2014 20:23:04,-0.840944,S2_Feeling_Down
5.01827E+17,"glad I'm working tomorrow, don't have to eat",glad working tomorrow eat,8/19/2014 20:24:37,-0.320971,S5_Eating_Disorder
5.01828E+17,I don't want to start uni fat,start uni fat,8/19/2014 20:28:11,-0.686383,S6_Feeling_Bad_About_Yourself
5.01828E+17,how perf to be beautiful,perf beautiful,8/19/2014 20:29:44,0.434003,Other
5.01828E+17,"RT @OhAnorexia: I really just miss the
emptiness
hunger pains
lightness",emptiness hunger pains lightness,8/19/2014 20:30:10,-0.33455,S5_Eating_Disorder
5.01829E+17,I'm so fucked up,fucked,8/19/2014 20:31:23,-0.917998,S6_Feeling_Bad_About_Yourself
5.01829E+17,There's no going back,,8/19/2014 20:31:35,-0.684578,Other
5.01829E+17,I'm beyond broken,broken,8/19/2014 20:31:47,-0.802917,S2_Feeling_Down
5.0185E+17,I love Pierce the Veil so much atm,love pierce veil atm,8/19/2014 21:53:41,0.240332,Other
5.0185E+17,"I'm so cold, I wish I had a metabolism",cold metabolism,8/19/2014 21:54:23,-0.511389,S2_Feeling_Down
5.0185E+17,I want to break every mirror,break mirror,8/19/2014 21:55:46,-0.848578,S6_Feeling_Bad_About_Yourself
5.0185E+17,I can't deal with this constant recovery-relapse cycle,deal constant recovery relapse cycle,8/19/2014 21:56:55,-0.73038,S2_Feeling_Down
5.02183E+17,LET ME LOSE WEIGHT,lose weight,8/20/2014 19:59:29,-0.693544,S6_Feeling_Bad_About_Yourself
5.02901E+17,ruined yet another night,ruined night,8/22/2014 19:31:58,-0.530723,S2_Feeling_Down
5.02901E+17,RT @stared909: But I can't never really be happy,happy,8/22/2014 19:32:51,-0.331685,S2_Feeling_Down
5.02901E+17,RT @stared909: Nothing is ok right now I'm ready to die,ready die,8/22/2014 19:33:03,-0.516641,S9_Suicidal_Thoughts
5.04709E+17,account got locked ffs,account locked ffs,8/27/2014 19:15:53,-0.598806,Other
5.04709E+17,shopping for freshers fortnight and I'm just thinking how fat I'll look in everything,shopping freshers fortnight thinking fat,8/27/2014 19:16:25,0.354181,S6_Feeling_Bad_About_Yourself
5.04725E+17,@stared909 I'll look nowhere as good as everyone else but ily,good ily,8/27/2014 20:21:50,-0.260224,S6_Feeling_Bad_About_Yourself
5.04726E+17,thinspo time,thin spo time,8/27/2014 20:22:03,0,Other
5.04726E+17,#fitspo #thinspo #thinspiration http://t.co/vk6bAVskCA,fits po thin spo inspiration,8/27/2014 20:23:10,0.39603,Other
5.04726E+17,#thinspo #thinspiration http://t.co/UdHAMezBYH,thin spo inspiration,8/27/2014 20:23:38,0,Other
5.04726E+17,#thinspiration #thinspo http://t.co/REY0zs9xDA,inspiration thin spo,8/27/2014 20:24:08,0,Other
5.04726E+17,#thinspo #thinspiration http://t.co/xD1b2YjaM4,thin spo inspiration,8/27/2014 20:24:53,0,Other
5.04727E+17,can't find any decent thinspo atm,find decent thin spo atm,8/27/2014 20:27:55,-0.718361,Other
5.04743E+17,shitty shitty mood,shitty shitty mood,8/27/2014 21:30:58,-0.938272,S2_Feeling_Down
5.04743E+17,for fucks sake,fucks sake,8/27/2014 21:31:09,-0.79044,S2_Feeling_Down
5.04743E+17,"fuck you
just fuck you",fuck fuck,8/27/2014 21:31:30,-0.708016,Other
5.04743E+17,RT @deIicatelythin: i want to cut until my wrist is raw,cut wrist raw,8/27/2014 21:31:54,-0.79854,S9_Suicidal_Thoughts
5.04743E+17,if I cut will you hate me?,cut hate,8/27/2014 21:32:17,-0.762044,S9_Suicidal_Thoughts
5.04743E+17,I've slipped right back to that dark place,slipped dark place,8/27/2014 21:32:33,-0.761336,S2_Feeling_Down
5.04743E+17,there's no way out,,8/27/2014 21:32:42,-0.621303,S2_Feeling_Down
5.04744E+17,rock bottom,rock bottom,8/27/2014 21:33:26,-0.303441,S2_Feeling_Down
5.04745E+17,my hip is so shredded I need somewhere new to cut,hip shredded cut,8/27/2014 21:38:12,-0.83031,S9_Suicidal_Thoughts
5.04749E+17,you hate me anyway so I may as well cut,hate cut,8/27/2014 21:55:53,-0.661344,S9_Suicidal_Thoughts
5.04749E+17,I can't even cut properly today ffs they won't bleed properly,cut properly ffs bleed properly,8/27/2014 21:56:42,-0.811975,S9_Suicidal_Thoughts
5.0475E+17,I can't stop,,8/27/2014 22:00:31,-0.599441,Other
5.0475E+17,I don't want this life,life,8/27/2014 22:00:41,-0.547624,S9_Suicidal_Thoughts
5.04751E+17,@1_last_time I'm so addicted to cutting my hips and thighs,addicted cutting hips thighs,8/27/2014 22:04:23,-0.849228,S9_Suicidal_Thoughts
5.04753E+17,@1_last_time do you go to a salon for hair removal then?,salon hair removal,8/27/2014 22:09:39,0.292488,Other
5.04753E+17,"@1_last_time sorry I read that wrong, I shave my own legs so I don't have that's problem, could you do your own?",read wrong shave legs problem,8/27/2014 22:10:14,-0.907749,Other
5.04754E+17,I'm so insecure,insecure,8/27/2014 22:13:35,-0.74055,S6_Feeling_Bad_About_Yourself
5.04754E+17,I can't lose you,lose,8/27/2014 22:13:46,-0.394673,S2_Feeling_Down
5.04754E+17,I know I'm pushing you away,pushing,8/27/2014 22:13:56,-0.330796,S2_Feeling_Down
5.04754E+17,It's happening all over again,happening,8/27/2014 22:14:07,0,S2_Feeling_Down
5.04754E+17,"@1_last_time if it's just your thigh then it doesn't matter too much, get your lower leg waxed or shaved or whatever &amp; do the rest yourself",thigh matter lower leg waxed shaved amp rest,8/27/2014 22:15:37,-0.651216,Other
5.04754E+17,my boyfriend says he loves me but I struggle to believe him,boyfriend loves struggle,8/27/2014 22:16:07,-0.65148,S2_Feeling_Down
5.04754E+17,"I mean, why would he love me",love,8/27/2014 22:16:19,-0.578836,S2_Feeling_Down
5.04754E+17,I'm a fucking mess,fucking mess,8/27/2014 22:16:27,-0.912823,S6_Feeling_Bad_About_Yourself
5.04754E+17,ok my cuts hurt now,cuts hurt,8/27/2014 22:16:50,-0.802944,S9_Suicidal_Thoughts
5.04754E+17,"I got blood all over my duvet, now what",blood duvet,8/27/2014 22:17:03,-0.703249,S9_Suicidal_Thoughts
5.04936E+17,can I be pretty yet?,pretty,8/28/2014 10:17:20,0.407911,S6_Feeling_Bad_About_Yourself
5.06176E+17,had such a good weekend actually,good weekend,8/31/2014 20:26:20,0.597327,Other
5.06366E+17,Dreading freshers week,dreading freshers week,9/1/2014 9:01:16,-0.812346,S1_little_interest
5.06366E+17,"can't wait to move out 
19 days left",wait move 19 days,9/1/2014 9:01:59,-0.308863,Other
5.0637E+17,I need to lose 10lbs in 29 days now,lose 10lbs 29 days,9/1/2014 9:15:15,-0.69257,S6_Feeling_Bad_About_Yourself
5.06484E+17,"RT @metpoliceuk: Alice Gross, 14, still missing from #Hanwell in #Ealing borough.  We urge anyone who may have seen her to call 101 http://…",alice gross 14 missing hanwell ealing borough urge call 101,9/1/2014 16:48:34,-0.571748,Other
5.06561E+17,@stared909 ilysm 💞💞💞💞💞💞💞,lys,9/1/2014 21:54:29,0,Other
5.06561E+17,@_alliwantisthin 29... 19 frickin typo,29 19 frickin typo,9/1/2014 21:55:06,-0.619663,Other
5.06561E+17,"""I'm gonna be happy from now on""
**is cutting two hours later**",happy cutting hours,9/1/2014 21:56:11,-0.0755619,S9_Suicidal_Thoughts
5.06561E+17,my best friend does nothing but annoy me atm,friend annoy atm,9/1/2014 21:56:36,-0.448441,Other
5.06704E+17,RT @dprssdanorexic: is it weird that i'm not afraid to show my scars? like i don't worry about it unless i have fresh cuts.,weird afraid scars worry fresh cuts,9/2/2014 7:22:21,-0.742691,S9_Suicidal_Thoughts
5.07101E+17,so so so so fat,fat,9/3/2014 9:39:23,0,S6_Feeling_Bad_About_Yourself
5.07263E+17,I can't deal with trying to recover anymore,deal recover,9/3/2014 20:23:58,-0.806901,Other
5.07263E+17,I don't know what to do anymore,,9/3/2014 20:24:18,-0.748072,S2_Feeling_Down
5.07263E+17,feel like my best friend competes to be more fucked up than me,feel friend competes fucked,9/3/2014 20:25:24,-0.820034,S2_Feeling_Down
5.07264E+17,"I want Christmas, I swear everything is better at Christmas",christmas swear christmas,9/3/2014 20:28:19,0.366786,Other
5.0727E+17,I can't deal,deal,9/3/2014 20:50:48,-0.739253,Other
5.07288E+17,ok I accidentally followed this girl that hates me so I panicked and set my account to private for the night,accidentally girl hates panicked set account private night,9/3/2014 22:02:43,-0.561186,Other
5.0785E+17,14 hour shift today 🔫,14 hour shift,9/5/2014 11:19:26,0,Other
5.08074E+17,RT @CharissaValenti: @mrjohnofarrell Would you help #FindAlice with a rt please? 14 years old and missing since Thurs 28/8 #Hanwell http://…,find alice 14 years missing thurs 288 hanwell,9/6/2014 2:06:11,-0.0633136,Other
5.08074E+17,RT @vickstervicki: @IAMJHUD Please retweet &amp; help us find Alice missing over a week now #Hanwell #UK #FindAlice @findalicegross http://t.co…,#N/A,9/6/2014 2:06:00,-0.292337,Other
5.08075E+17,"everyone please please RT the #FindAlice #findalicegross 
she is missing and needs finding",find alice find alice gross missing finding,9/6/2014 2:12:13,-0.812735,Other
5.08964E+17,fattttt,fat tttt,9/8/2014 13:03:21,-0.467988,Other
5.08964E+17,think I'll fast tomorrow,fast tomorrow,9/8/2014 13:03:40,0,S5_Eating_Disorder
5.08964E+17,I want to give up this shitty disorder now please,shitty disorder,9/8/2014 13:04:10,-0.935559,S2_Feeling_Down
5.08964E+17,RT @fakee_smiless: Nearly had a panic attack at lunch 😓,panic attack lunch,9/8/2014 13:04:24,-0.681969,S2_Feeling_Down
5.08964E+17,RT @why_food: I am sooooo FATTTTTTTT,oooo fat ttt tttt,9/8/2014 13:04:28,-0.611863,S6_Feeling_Bad_About_Yourself
5.10181E+17,my twitter account keeps locking me out what is this,twitter account locking,9/11/2014 21:40:55,0,Other
5.10182E+17,"I haven't eaten today, this is good",eaten good,9/11/2014 21:42:12,0,S5_Eating_Disorder
5.10182E+17,"I love watching 90210, everyone is so skinny and perfect",love watching 90210 skinny perfect,9/11/2014 21:42:38,0.840644,Other
5.10186E+17,I can't wait for uni so that I can fast and diet properly and have full control,wait uni fast diet properly full control,9/11/2014 22:00:33,0.716487,S5_Eating_Disorder
5.10186E+17,such pretty #thinspo http://t.co/1QSNr7qkwj,pretty thin spo,9/11/2014 22:01:36,0,Other
5.10187E+17,to look that good in jeans... #thinspo #thinspiration http://t.co/JXIc8RX7m2,good jeans thin spo inspiration,9/11/2014 22:02:29,0.658388,Other
5.10187E+17,It's so unfair how perfect some people are #thinspo #thinspiration #thighgap http://t.co/CehCSpZ62H,unfair perfect people thin spo inspiration thigh gap,9/11/2014 22:03:31,-0.684658,Other
5.10187E+17,can't wait for proper winter thinspo again #thinspo #thinspiration #thighgap #skinny http://t.co/AbS7dY8KIW,wait proper winter thin spo thin spo inspiration thigh gap skinny,9/11/2014 22:04:31,0,Other
5.10395E+17,RT @starvingbitxh: Need to be skinny for freshers,skinny freshers,9/12/2014 11:48:44,-0.442825,Other
5.10869E+17,fed up of being fat,fed fat,9/13/2014 19:15:29,-0.696464,S6_Feeling_Bad_About_Yourself
5.10869E+17,Nothing works,works,9/13/2014 19:15:39,-0.534888,S2_Feeling_Down
5.10869E+17,wifi is down oh shit,wifi shit,9/13/2014 19:15:45,-0.866969,Other
5.10881E+17,I don't want to go to uni bc I don't want to leave my boyfriend behind,uni bc leave boyfriend,9/13/2014 20:03:17,-0.727377,S2_Feeling_Down
5.10897E+17,I'm scared of everything right now,scared,9/13/2014 21:04:01,-0.817258,S2_Feeling_Down
5.10897E+17,my mum searches for more and more things to be wrong with me,mum searches things wrong,9/13/2014 21:05:44,-0.592889,S2_Feeling_Down
5.11426E+17,mum is just constantly trying to force feed me,mum constantly force feed,9/15/2014 8:05:29,-0.606791,S5_Eating_Disorder
5.11426E+17,"I've been trying to recover for seven months now but I don't want to anymore so I'm giving into ana, she's too strong",recover months strong,9/15/2014 8:06:36,0.286605,S5_Eating_Disorder
5.11452E+17,pissed off at the world rn,pissed rn,9/15/2014 9:49:57,-0.763242,S2_Feeling_Down
5.11452E+17,lyf sux,lyf sux,9/15/2014 9:50:42,-0.789413,S2_Feeling_Down
5.11484E+17,Fucking arguments,fucking arguments,9/15/2014 11:57:44,-0.658578,Other
5.11484E+17,fucking hate everything,fucking hate,9/15/2014 11:58:20,-0.908243,S2_Feeling_Down
5.11484E+17,want to cut,cut,9/15/2014 11:58:38,0,S9_Suicidal_Thoughts
5.11632E+17,why do I have a load of weird people on my twitter??,load weird people twitter,9/15/2014 21:44:03,-0.669828,Other
5.11633E+17,I can't deal with being this fat,deal fat,9/15/2014 21:49:05,-0.775983,S6_Feeling_Bad_About_Yourself
5.11989E+17,I wish I could just have five minutes of the day when I don't feel fat and hate myself,minutes day feel fat hate,9/16/2014 21:24:04,-0.917654,S6_Feeling_Bad_About_Yourself
5.11992E+17,RT @Sassy_Whxre: I'm so fucking fed up of always making the wrong choices and always trying my hardest but getting shit things as a result,fucking fed making wrong choices hardest shit things result,9/16/2014 21:34:56,-0.89006,S6_Feeling_Bad_About_Yourself
5.12709E+17,"@Melisa_aaron @AddictRecovered and it's what we like, we never asked for your opinion",asked opinion,9/18/2014 21:06:50,0.259631,Other
5.12709E+17,I always need him when he's not around,,9/18/2014 21:07:18,-0.425003,Other
5.12939E+17,I'm so bored of packing for uni now,bored packing uni,9/19/2014 12:21:20,-0.83055,S1_little_interest
5.13094E+17,excited to move out tomorrow but I'm going to miss my boyfriend like crazy,excited move tomorrow boyfriend crazy,9/19/2014 22:34:37,-0.845058,Other
5.13441E+17,Uni is fucking mental,uni fucking mental,9/20/2014 21:35:46,-0.837546,S2_Feeling_Down
5.13504E+17,RT @Just_KillMeNow_: I absolutely have no idea how people can drink beer. It's so disgusting,absolutely idea people drink beer disgusting,9/21/2014 1:42:48,-0.705413,Other
5.13508E+17,@stared909 you're amazing and you'll always have me by your side xxxx,amazing 'll side xxxx,9/21/2014 1:58:49,0.819886,Other
5.13634E+17,I haven't even been here for 24 hours and I want to go home,24 hours,9/21/2014 10:19:51,-0.714633,Other
5.14629E+17,fucking petrified of losing you,fucking petrified losing,9/24/2014 4:12:55,-0.894098,S2_Feeling_Down
5.15821E+17,I want to go home,,9/27/2014 11:09:54,-0.497412,Other
5.15821E+17,I hate it here so much,hate,9/27/2014 11:10:30,-0.883194,Other
5.15826E+17,I just need someone to hold me while I cry,hold cry,9/27/2014 11:30:42,-0.768703,S2_Feeling_Down
5.15826E+17,I'm so alone,,9/27/2014 11:31:46,-0.676223,S2_Feeling_Down
5.15828E+17,I haven't cried like this in so long,cried,9/27/2014 11:40:02,-0.638075,S2_Feeling_Down
5.17367E+17,fucking account keeps getting blocked ffs,fucking account blocked ffs,10/1/2014 17:32:49,-0.81952,Other
5.2016E+17,"someone keeps posting on my twitter and getting my account locked. 
fuck off",posting twitter account locked fuck,10/9/2014 10:31:17,-0.205149,Other
5.2016E+17,"I'm going home in just under a week and i'm so tempted to just fast until then
my flat mates are already suspicious though",week tempted fast flat mates suspicious,10/9/2014 10:32:04,-0.658571,S5_Eating_Disorder
5.2016E+17,so glad I have twitter back at last,glad twitter,10/9/2014 10:32:24,0.51127,Other
5.20161E+17,14 hours into my fast,14 hours fast,10/9/2014 10:38:55,0,S5_Eating_Disorder
5.20588E+17,I'm so hungry but I don't deserve to eat,hungry deserve eat,10/10/2014 14:53:19,-0.744062,S5_Eating_Disorder
5.20981E+17,I hate everything I see looking back at me in the mirror,hate mirror,10/11/2014 16:55:44,-0.841386,S6_Feeling_Bad_About_Yourself
5.20981E+17,can't be around my flat mates at the moment,flat mates moment,10/11/2014 16:56:54,-0.71494,Other
5.21392E+17,ugh I just can't do this,ugh,10/12/2014 20:07:39,-0.933095,S2_Feeling_Down
5.21928E+17,I'm so fat and disgusting I can't deal with this anymore,fat disgusting deal,10/14/2014 7:37:03,-0.951093,S6_Feeling_Bad_About_Yourself
5.21928E+17,I don't want to live like this anymore,live,10/14/2014 7:37:43,-0.809461,S9_Suicidal_Thoughts
5.21961E+17,I'm waiting in the gym changing rooms until 11 so I don't have to bike past everyone going to lectures,waiting gym changing rooms 11 bike lectures,10/14/2014 9:50:59,-0.499194,S6_Feeling_Bad_About_Yourself
5.22369E+17,I haven't weighed myself for four weeks and I have no idea what I'll see now I'm going home,weighed weeks idea,10/15/2014 12:51:58,-0.463303,S6_Feeling_Bad_About_Yourself
5.22856E+17,Still haven't brought myself to weigh yet,brought weigh,10/16/2014 21:07:09,-0.509169,S6_Feeling_Bad_About_Yourself
5.22859E+17,"Hate myself
Hate myself so much",hate myselfhate,10/16/2014 21:18:27,-0.846892,S6_Feeling_Bad_About_Yourself
5.22865E+17,#thinspo #thinspiration http://t.co/9VZHkOCvOW,thin spo inspiration,10/16/2014 21:40:34,0,Other
5.22865E+17,#thinspo #thinspiration #skinny http://t.co/himGM1YdOm,thin spo inspiration skinny,10/16/2014 21:41:02,0.231856,Other
5.22865E+17,#thinspo #thinspiration #thighgap http://t.co/vrbHQZk3oo,thin spo inspiration thigh gap,10/16/2014 21:41:26,0,Other
5.22865E+17,#thinspo http://t.co/34d6p0MqhD,thin spo,10/16/2014 21:42:11,-0.407737,Other
5.22865E+17,#thinspo #thinspiration #thighgap http://t.co/JqiTfbgMMv,thin spo inspiration thigh gap,10/16/2014 21:42:33,0,Other
5.22866E+17,I feel so disgusting,feel disgusting,10/16/2014 21:45:42,-0.742891,S6_Feeling_Bad_About_Yourself
5.22866E+17,feel like it's time to cut again,feel time cut,10/16/2014 21:45:55,0,S9_Suicidal_Thoughts
5.22866E+17,nothing ever goes my way,,10/16/2014 21:46:07,-0.604253,S6_Feeling_Bad_About_Yourself
5.22866E+17,my parents are so full of bullshit,parents full bullshit,10/16/2014 21:46:34,-0.753467,S2_Feeling_Down
5.22866E+17,this world is so full of bullshit,full bullshit,10/16/2014 21:46:48,-0.67359,S2_Feeling_Down
5.22866E+17,I can't wait to go back to uni,wait uni,10/16/2014 21:46:59,0,Other
5.2287E+17,so ready to give up now,ready,10/16/2014 22:01:42,0.204449,S2_Feeling_Down
5.2287E+17,I miss cutting so much but ugh,cutting ugh,10/16/2014 22:03:27,-0.930319,S9_Suicidal_Thoughts
5.22871E+17,"I know I'll be 0 days clean soon, my blade doesn't leave my side",days clean blade leave side,10/16/2014 22:04:20,-0.516272,S9_Suicidal_Thoughts
5.22871E+17,I've got so much work to do tomorrow that I've been putting off all week,work tomorrow putting week,10/16/2014 22:05:08,-0.762551,S7_Concentration_Problems
5.22871E+17,"RT @SucidialSkinny: Mom: beauty is in the eye of the beholder
Me: sometimes the beholder is blind",mom beauty eye beholder beholder blind,10/16/2014 22:07:04,0.0687612,S6_Feeling_Bad_About_Yourself
5.22872E+17,"missing @stared909 
feeling so distanced atm",missing feeling distanced atm,10/16/2014 22:09:51,-0.797772,Other
5.231E+17,Feeling so disgusting rn,feeling disgusting rn,10/17/2014 13:15:29,-0.882918,S6_Feeling_Bad_About_Yourself
5.231E+17,going out drinking tonight but i really don't want to drink,drinking tonight drink,10/17/2014 13:15:56,-0.640344,Other
5.23259E+17,"home is shit, want to go back to uni",shit uni,10/17/2014 23:47:25,-0.825247,S2_Feeling_Down
5.23268E+17,"tonight has been the shittest night 
fuck you
fuck all of you",tonight shit test night fuck fuck,10/18/2014 0:24:30,-0.694038,S2_Feeling_Down
5.23268E+17,and fucking fuck you,fucking fuck,10/18/2014 0:24:49,-0.833186,Other
5.23269E+17,want to cut but at boyf's and can't find my blade fuck fuck fuck,cut boyf's find blade fuck fuck fuck,10/18/2014 0:25:44,-0.915832,S9_Suicidal_Thoughts
5.23592E+17,mum got me this book bc she knows I'm struggling at uni and I know she's struggling with me gone 😞 http://t.co/VMNeeBETJs,mum book bc struggling uni struggling,10/18/2014 21:48:37,-0.833635,S2_Feeling_Down
5.23928E+17,I'm slipping back so badly,slipping badly,10/19/2014 20:05:32,-0.879247,S2_Feeling_Down
5.23954E+17,I don't want to do this again,,10/19/2014 21:50:46,-0.649735,S1_little_interest
5.23955E+17,"RT @Prettyinthin: Normal people: I'm starving. I haven't eaten since breakfast

You (in Your head): LOL no you're not. You don't know ""star…",normal people starving eaten breakfast head lol star,10/19/2014 21:51:52,-0.505713,Other
5.23955E+17,RT @bclifesux: Fuck forever fuck always fuck all the other promises you've broken,fuck forever fuck fuck promises 've broken,10/19/2014 21:54:22,-0.921362,S2_Feeling_Down
5.23956E+17,I need to make the most of being at uni before Christmas and fast &amp; restrict as much as possible,uni christmas fast amp restrict,10/19/2014 21:55:11,-0.648172,S5_Eating_Disorder
5.23956E+17,haven't spoken to my best friend in a month now,#N/A,10/19/2014 21:56:47,-0.49922,S2_Feeling_Down
5.23956E+17,RT @WannaBeThinspo7: I don't want my thighs too touch grrrrr.,thighs touch grrrr,10/19/2014 21:57:07,-0.586365,S6_Feeling_Bad_About_Yourself
5.23956E+17,why do my thighs still touch,thighs touch,10/19/2014 21:57:32,-0.74552,S6_Feeling_Bad_About_Yourself
5.23957E+17,I'm so hungry this feels so good,hungry feels good,10/19/2014 22:00:13,-0.615696,S5_Eating_Disorder
5.24104E+17,"@RhonaBlack2 it's worth it to me, the only difference you'll see from one fast is potentially less bloating, you'd have to fast &amp; restrict",worth difference 'll fast bloating 'd fast amp restrict,10/20/2014 7:45:33,0,S5_Eating_Disorder
5.24653E+17,I'm fed up of painting a smile on my face everyday,fed painting smile face everyday,10/21/2014 20:06:12,0.727584,S2_Feeling_Down
5.24826E+17,RT @Ana_Rex_Mia: I smile and everyone thinks im happy when im really dying on the inside!,smile thinks happy dying,10/22/2014 7:34:26,0.864315,S2_Feeling_Down
5.25058E+17,RT @stared909: Can't wait till I'm home and I can have proper chats with @_alliwantisthin 💞,wait proper chats,10/22/2014 22:57:43,0.655876,Other
5.25604E+17,I kind of wish I wanted to recover,kind wanted recover,10/24/2014 11:07:15,-0.569617,Other
5.25604E+17,Fed up of being miserable,fed miserable,10/24/2014 11:07:24,-0.796188,S2_Feeling_Down
5.26005E+17,I'm not even sure you love me anymore,love,10/25/2014 13:38:20,-0.743133,S2_Feeling_Down
5.26124E+17,the mirror just screams fat at me,mirror screams fat,10/25/2014 21:29:55,-0.849072,S6_Feeling_Bad_About_Yourself
5.26124E+17,FAT,fat,10/25/2014 21:30:02,-0.467988,Other
5.26124E+17,I hate yiy,hate yi,10/25/2014 21:30:17,-0.872002,Other
5.26372E+17,please make the voices stop,voices,10/26/2014 13:55:26,-0.434155,Other
5.26659E+17,Actually motivated for uni today,motivated uni,10/27/2014 8:59:27,0.518796,Other
5.2666E+17,Fasting for as long as possible now,fasting,10/27/2014 9:00:02,0,S5_Eating_Disorder
5.26712E+17,RT @waifishghost: i don't dare weigh myself tbh,weigh tbh,10/27/2014 12:27:58,-0.522902,S5_Eating_Disorder
5.26803E+17,just fuck off,fuck,10/27/2014 18:28:53,-0.830608,S6_Feeling_Bad_About_Yourself
5.26803E+17,"i hate you right now
so much",hate,10/27/2014 18:29:23,-0.814233,Other
5.26803E+17,I can't deal with you on top of everything else r/n,deal top rn,10/27/2014 18:30:48,-0.545007,S2_Feeling_Down
5.26803E+17,everything just gets too much way too quickly,,10/27/2014 18:31:19,0.67503,S2_Feeling_Down
5.28551E+17,i need my wifi to start working again,wifi start working,11/1/2014 14:14:57,-0.763555,Other
5.28556E+17,RT @forever__fat__: I think I fucked up... AGAIN,fucked,11/1/2014 14:33:55,-0.86353,S6_Feeling_Bad_About_Yourself
5.28616E+17,I want my boyfriend here,boyfriend,11/1/2014 18:35:14,-0.257504,Other
5.29424E+17,a month without you is so difficult,month difficult,11/4/2014 0:05:34,-0.652861,S2_Feeling_Down
5.29424E+17,"Crying myself to sleep every night bc I can't see you 
How pathetic",crying sleep night bc pathetic,11/4/2014 0:06:20,-0.75397,S6_Feeling_Bad_About_Yourself
5.29424E+17,"I am 
so 
pathetic",pathetic,11/4/2014 0:06:47,-0.705934,S6_Feeling_Bad_About_Yourself
5.29425E+17,can't sleep,sleep,11/4/2014 0:07:05,-0.69582,S3_Sleep_Disorder
5.29425E+17,RT @scarsjpg_: Ed sheeran was amazing👌👌 he's so good live,sheeran amazing good live,11/4/2014 0:07:59,0.491434,Other
5.2995E+17,So close to giving up,,11/5/2014 10:55:27,0.572281,S2_Feeling_Down
5.29952E+17,you're the only person I need to care and you just don't,person care,11/5/2014 11:04:43,-0.593298,S2_Feeling_Down
5.29955E+17,I'm so miserable I've gone numb,miserable numb,11/5/2014 11:13:08,-0.936433,S2_Feeling_Down
5.30094E+17,@stared909 love you forever xxxxxxxx,love forever xxxx xxxx,11/5/2014 20:28:03,0.602978,Other
5.31034E+17,I'm so exhausted,exhausted,11/8/2014 10:43:29,-0.677809,S4_lassitute
5.31372E+17,so behind with uni work,uni work,11/9/2014 9:05:27,-0.601977,Other
5.31373E+17,I want to lose weight quicker,lose weight quicker,11/9/2014 9:10:23,-0.773282,Other
5.31374E+17,I need to lose weight quicker now,lose weight quicker,11/9/2014 9:12:11,-0.731969,Other
5.31587E+17,such a fat day today,fat day,11/9/2014 23:18:48,-0.629656,S6_Feeling_Bad_About_Yourself
5.31851E+17,I wish I could reach my ugw by Christmas,reach ug christmas,11/10/2014 16:49:14,-0.371072,Other
5.31851E+17,my flat mates are definitely starting to notice me avoiding food,flat mates starting notice avoiding food,11/10/2014 16:50:09,-0.792361,S5_Eating_Disorder
5.31851E+17,RT @hello_hipbones: Everything would look so much cuter on me if I had a strong thigh gap game.,cuter strong thigh gap game,11/10/2014 16:50:16,0.571323,S6_Feeling_Bad_About_Yourself
5.31996E+17,"so fucking fat, I hate this",fucking fat hate,11/11/2014 2:24:25,-0.952307,S6_Feeling_Bad_About_Yourself
5.31996E+17,RT @selfhatescars: Why the fuck did you have to go to bed,fuck bed,11/11/2014 2:24:31,-0.766118,Other
5.31997E+17,"RT @Caitie_Cait13: The hours between 12 pm and 6 am have a funny habit of making you feel like you're either on top of the world, or under …",hours 12 pm funny habit making feel top,11/11/2014 2:28:20,0.691274,Other
5.32247E+17,"15 calorie dinner
Perks of uni life",15 calorie dinner perks uni life,11/11/2014 19:02:03,0.323314,S5_Eating_Disorder
5.32247E+17,RT @many_bruises: I just need some time by myself and too cool off,time cool,11/11/2014 19:03:27,0.533643,Other
