Tweet_ID,Raw_text,Cleaned_text,Created_at,Sentiment,Annotation
544366524807389186,please don't jump to conclusions. resist #Islamophobia remember this is a crime that hurts muslims too #terroist #hostages #sydneysiege,jump conclusions resist islamophobia remember crime hurts muslims terr ist hostages sydney siege,12/15/2014 5:41:08,-0.793734,S2_Feeling_Down
542662922099367937,"no words needed.
#PhillipHughes  http://t.co/CGjRu8eOLc",phillip hughes,12/10/2014 12:51:37,-0.31541,Other
325939739880484864,"Someone will always have more problems than you, but that doesn't mean your problems don't matter!",problems problems matter,4/21/2013 11:51:04,-0.452515,S2_Feeling_Down
325907844207628288,@AgirlafterGod28 so what have you been up to?,,4/21/2013 9:44:19,-0.307101,Other
3.26E+17,Sundays go way to fast:'(,sundays fast,4/21/2013 9:34:36,-0.704844,S2_Feeling_Down
325904158140030976,I just realised 90% of my contacts in my phone are useless!,realised 90 contacts phone useless,4/21/2013 9:29:40,-0.766558,Other
325898043608158210,@AgirlafterGod28 yeah im really good so whats been happening with you hun?,yeah good happening hun,4/21/2013 9:05:23,0.489866,Other
325888145818275840,@AgirlafterGod28 hey long time no hear. How are you?,hey time hear,4/21/2013 8:26:03,0,Other
325707251107102721,@DSIsGodWWETNAx3 aw thankyou your kind words are boundless. Love to you&lt;3,aw thankyou kind boundless love lt3,4/20/2013 20:27:14,0.641467,Other
325706852677591040,@mariahmilano_ aw thankyou your very kind&lt;3,aw thankyou kind lt3,4/20/2013 20:25:39,0.401433,Other
325706306159788032,Thats why your so special&lt;3 @coicele @darkest_shades,lt3,4/20/2013 20:23:29,-0.418022,Other
325698199392231424,@Kahleah1 yes and it's so heart warming&lt;3,heart warming lt3,4/20/2013 19:51:16,0.607555,Other
325697342965678081,@Darkzey &lt;3,lt3,4/20/2013 19:47:52,0.346017,Other
325696709156016130,"I don't want to fix you, I want you as you are!",,4/20/2013 19:45:21,0,Other
325694305995988992,@voicelessnomore couldn't of said it any better my self hun&lt;3,hunlt3,4/20/2013 19:35:48,-0.217615,Other
325693619019333632,@SKINNYboi_thin hey hun hope all is well with you&lt;3,hey hun hope lt3,4/20/2013 19:33:04,0.640607,Other
325689619159076865,@uniquelydemi hey sweet are you okay? Why are you so sad?,hey sweet sad,4/20/2013 19:17:10,-0.0868647,S2_Feeling_Down
325688922036400129,"@babybrunettegal aw thats not good hun, hope you feel better soon&lt;3",aw good hun hope feel lt3,4/20/2013 19:14:24,-0.482201,Other
325688676099174401,Don't judge people until you truly know them. The truth might surprise you!,judge people truth surprise,4/20/2013 19:13:26,0.685305,S2_Feeling_Down
325686850951987200,@babybrunettegal you okay hun?,hun,4/20/2013 19:06:10,0,Other
325686448491737089,@78_Dre &lt;3,lt3,4/20/2013 19:04:34,0.346017,Other
325685298833002496,@HotNuberu2 &lt;3,lt3,4/20/2013 19:00:00,0,S2_Feeling_Down
325683982199033856,@cookietweets lol no i believe you can sort a lot shit out&lt;3,lol sort lot shit lt3,4/20/2013 18:54:46,-0.533127,Other
325682631591211008,@Jonaai_Loove be very carefull who your sending abuse to. Be warned!,carefull sending abuse warned,4/20/2013 18:49:24,-0.517323,Other
325681705421783040,Sometimes you have to accept the fact that certain things will never go back to how they use to be!,accept fact things,4/20/2013 18:45:44,-0.313583,S2_Feeling_Down
325681442086596608,"When you're right no one remembers, when you're wrong no one forgets!",remembers wrong forgets,4/20/2013 18:44:41,-0.363825,S2_Feeling_Down
325552985499373568,"Im so excited winter is on the way, for some reason my mood changes in a  good way when it rains!",excited winter reason mood good rains,4/20/2013 10:14:14,0.924047,S2_Feeling_Down
325541465570803713,Hope you all are having a great Saturday&lt;3,hope great saturday lt3,4/20/2013 9:28:28,0.67572,S2_Feeling_Down
325307362091085825,"You can't tell someone to ""just get over it."" It doesn't work that way!",work,4/19/2013 17:58:13,-0.54069,S2_Feeling_Down
325306989116784640,"Just because it's easy to say ""stay strong"" doesn't mean it's easy to do it!",easy stay strong easy,4/19/2013 17:56:44,0.692862,S2_Feeling_Down
325277091769757696,Life is to short to stress yourself with people who don't even deserve to be an issue your life!,life stress people deserve issue life,4/19/2013 15:57:56,-0.80131,S2_Feeling_Down
325116093196808193,Basic rule number one: never rely on anyone!,basic rule number rely,4/19/2013 5:18:11,0,S2_Feeling_Down
320816344218087425,Hope everyone is having a wonderfull Sunday&lt;3,hope wonderfull sunday lt3,4/7/2013 8:32:31,0.502737,Other
320557472681189378,@recklessrecover thats okay hun&lt;3,hunlt3,4/6/2013 15:23:51,0.320375,Other
320557079993675776,Hug&lt;3 @ICareAboutYou7 @PainEndsInDeath,huglt3,4/6/2013 15:22:18,0,Other
320556352755867648,@GarretteDeborah its sad it happens to 40 people a night that i follow. So there so many more i dont know about&lt;3,sad 40 people night follow dont lt3,4/6/2013 15:19:24,-0.620698,S2_Feeling_Down
315448120119013378,@EmmanuellaQ thaks hun it means alot&lt;3,thaks hun alotlt3,3/23/2013 13:01:07,0,Other
315447140694515712,Hope every one is having a good night/day. Me; im feeling very low and deflated today just cant shake it!,hope good night day feeling low deflated shake,3/23/2013 12:57:13,-0.229043,S2_Feeling_Down
315422448571011074,@Obyjoy sure following now,,3/23/2013 11:19:06,0,S2_Feeling_Down
315161474400141312,"I'm not afraid to try again, I'm just afraid of getting hurt for the same reason.",afraid afraid hurt reason,3/22/2013 18:02:05,-0.884042,S2_Feeling_Down
315155136303464449,Biggest mistake you can make is thinking everyone is your friend.,biggest mistake thinking friend,3/22/2013 17:36:54,-0.527537,S2_Feeling_Down
315137429310951424,@TheSucidalKid hey my sweet angel please stay strong dm if you need to talk you are loved&lt;3,hey sweet angel stay strong dm talk love dlt3,3/22/2013 16:26:32,0.883274,Other
315136787989266432,@hollywoodgirl25 why whats happened hun?,happened hun,3/22/2013 16:23:59,-0.714855,Other
315134153576288256,@racoon_eyes i wish you happiness and strength&lt;3,happiness strength lt3,3/22/2013 16:13:31,0.639271,Other
315133619653996545,@MphoMutla @agornowicz87 oh yes they will strong believer in karma&lt;3,strong believer karma lt3,3/22/2013 16:11:24,0.517957,Other
315120928935792640,@agornowicz87 NO WAY! it happened to my twitter account 2 days ago which bought a lot of haters my way. Their scum!!!!,happened twitter account days bought lot haters scum,3/22/2013 15:20:58,-0.55257,Other
315120211772731394,@olasfanzine you were one of my first followers. Im always happy 2 here from you. Even though i didn't get your humour @ first! Now i do :-),followers happy humour,3/22/2013 15:18:07,0.286185,Other
315118817535729665,@agornowicz87 hello my little ray of sunshine hope your doing well. Love the new pics xox,ray sunshine hope love pics xox,3/22/2013 15:12:35,0.813576,Other
315117089918681088,Blocked button has been usefull tonight!!,blocked button usefull tonight,3/22/2013 15:05:43,-0.477822,S2_Feeling_Down
315112951533146113,"@th0ughtsOfDeath aw dont be sweet, whats on your mind?",aw dont sweet mind,3/22/2013 14:49:16,-0.316644,Other
315112391627137024,@_b_king lol very true!,lol,3/22/2013 14:47:03,0.788047,Other
314999318593556480,"@StratfordCherry aw thankyou, your very kind&lt;3",aw thankyou kind lt3,3/22/2013 7:17:44,0.395124,Other
314996573027332097,Thankyou to every one of you for your love and support this week. I could not of got though this without the support i recieved love you xox,thankyou love support week support recieved love xox,3/22/2013 7:06:50,0.810996,S2_Feeling_Down
314989654128611329,@blackhorse775i aw thanks sweet i'll read it&lt;3,aw sweet read itlt3,3/22/2013 6:39:20,0.717077,S2_Feeling_Down
314987339506151424,@HilaryFran my pleasure hun&lt;3,pleasure hunlt3,3/22/2013 6:30:08,0.539048,Other
314776950948372482,I have more of a social life on twitter then in my own life out side twitter. Sad but true!,social life twitter life side twitter sad,3/21/2013 16:34:08,0.25229,S2_Feeling_Down
314776452581191682,"I hate that i can't control my feelings, but I hate how my feelings can control me.",hate control feelings hate feelings control,3/21/2013 16:32:09,-0.930485,S6_Feeling_Bad_About_Yourself
314775504727195649,One mistake and everyone judges you.,mistake judges,3/21/2013 16:28:23,-0.742385,Other
314770745110691840,@BeingYourself97 aw sweet thanks for letting me know i was worried. Stay strong beautifull xox,aw sweet letting worried stay strong beautifull xox,3/21/2013 16:09:28,0.837427,Other
314769863509946369,@greeneyedvixen2 i didn't know you were following me. Sorry now following back&lt;3,lt3,3/21/2013 16:05:58,-0.528938,Other
314764752435949568,Watching your ex go through what he put you through.. Priceless.,watching priceless,3/21/2013 15:45:39,0.491883,S2_Feeling_Down
314760811547594752,Can someone bring me over a cherry wripe. Please xox,bring cherry ripe xox,3/21/2013 15:30:00,-0.283815,S2_Feeling_Down
314750502262935554,@iAmInPieces sweetheart their bullies! dont believe any of it. Your beautifull and very much loved xox,sweetheart bullies dont beautifull loved xox,3/21/2013 14:49:02,0.104021,Other
314747747104333828,"I wanted to text you but, then I remembered we don't talk anymore.",wanted text remembered talk,3/21/2013 14:38:05,-0.435618,S2_Feeling_Down
314744284358246400,@olasfanzine it's still nice to know your around xox,nice xox,3/21/2013 14:24:19,0.767844,Other
314743247878627329,"It’s not who you are that holds you back, It’s who you think you’re not.",holds,3/21/2013 14:20:12,0,S2_Feeling_Down
314741342980935681,RT @hollywoodgirl25: @crakkmeup95 ur amazing,ur amazing,3/21/2013 14:12:38,0,Other
314726532948033536,@tegiortega lol never thought it would feel so good&lt;3,lol thought feel good lt3,3/21/2013 13:13:47,0.242254,Other
314725168855515137,"Before you ""assume"" try this method called ""ask""",assume method called,3/21/2013 13:08:22,0,S2_Feeling_Down
314722438183284738,@sweetcheex93 aw your just as cute *blushing* lol,aw cute blushing lol,3/21/2013 12:57:31,0.368158,Other
314720745915834368,@sweetcheex93 but it's true lol,lol,3/21/2013 12:50:47,0.699944,Other
314719772698886146,@olasfanzine aw hello stranger long time know here&lt;3,aw stranger time lt3,3/21/2013 12:46:55,0,Other
314718544984170496,Do you ever just wake up and go “nope” and roll over and go back to sleep.,wake nope roll sleep,3/21/2013 12:42:02,0,S2_Feeling_Down
314717792043679744,"Message sent failed. Would you like to retry?"" Well, OBVIOUSLY, I was sending it for a reason.",message failed retry sending reason,3/21/2013 12:39:03,0.000391821,S2_Feeling_Down
314716036291252225,@BeingYourself97 hey sweetheart you must tell someone please. Hope your okay dm if you need to talk stay strong angel&lt;3,hey sweetheart hope dm talk stay strong angel lt3,3/21/2013 12:32:04,0.449358,Other
314715132297105408,RT @DodgersGibson23: @crakkmeup95 thank you for the following back :-)  loving your tweets sweetheart &lt;3,loving tweet sweetheart lt3,3/21/2013 12:28:29,0.957326,Other
314715122755067904,"@DodgersGibson23 aw thankyou, your very kind&lt;3",aw thankyou kind lt3,3/21/2013 12:28:27,0.395124,Other
314699843694108672,"I love hearing the words, ""I miss you."" if only some one would say it and mean it!",love hearing,3/21/2013 11:27:44,-0.578109,S2_Feeling_Down
314698170640785409,"Just because I'm being quiet, that doesn't mean I'm mad. Sometimes I'm just not in the mood to talk.",quiet mad mood talk,3/21/2013 11:21:05,-0.508837,S2_Feeling_Down
314680556292018176,@gypsy1207 aw thats so beautifull thankyou so much. You have a beautifull soul sending a hug your way&lt;3,aw beautifull thankyou beautifull soul sending hug waylt3,3/21/2013 10:11:05,0.490666,Other
314657921831157760,@itsTylerStarr of course hun following now&lt;3,hun lt3,3/21/2013 8:41:09,0.429809,Other
314656836412383233,"Sometimes you don't know how strong you are until the day you look back and realize that despite everything, you're still standing.",strong day realize standing,3/21/2013 8:36:50,-0.214481,S2_Feeling_Down
314655545187508224,"Thank god im feeling better, thankyou to all of you that wished me well. I really felt the love thankyou xox",god feeling thankyou wished felt love thankyou xox,3/21/2013 8:31:42,0.933609,Other
314323662436192256,"Screen to bright for my migraine, back to bed for me! I miss you all already, sounds crazy but i do! Will be back soon. Please keep safe&lt;3",screen bright migraine bed sounds crazy safe lt3,3/20/2013 10:32:55,-0.502304,Other
314238896684818432,Iv'e got a killer migraine back to bed! Hope you all have a wonderfull day/night&lt;3,iv'e killer migraine bed hope wonderfull day night lt3,3/20/2013 4:56:05,-0.219606,S2_Feeling_Down
314000009483923457,"I seriously over think everything, which makes me stress myself out and create problems that weren't even there in the first place.",stress create problems place,3/19/2013 13:06:50,-0.780942,S2_Feeling_Down
313991288947109889,"Don't do it for them because you have to, do it because you want to.",,3/19/2013 12:32:11,-0.460778,S2_Feeling_Down
313990839351246849,"Bad news is, everyone is not going to like you. Good news is, that's not your problem.",bad news good news problem,3/19/2013 12:30:24,-0.729192,S2_Feeling_Down
313989543139356673,@smudgysmudge GO THE SPURS!!!!!,spurs,3/19/2013 12:25:15,0.255815,Other
313978555224707072,Life is too damn short to give another minute to anyone or anything that doesn't make you happy.,life damn minute happy,3/19/2013 11:41:35,-0.834053,S2_Feeling_Down
313963088871313408,"Paper cuts: so small, but so evil.",paper cuts evil,3/19/2013 10:40:08,-0.770768,S2_Feeling_Down
313950683571302400,@SH_LC see thats why i love you. Never change&lt;3,love change lt3,3/19/2013 9:50:50,0.123211,Other
313934518966972416,"There is no ""wrong"" in life. Nothing is a mistake, everything is an experience.",wrong life mistake experience,3/19/2013 8:46:36,-0.671757,S2_Feeling_Down
313934347306692608,"Never ignore a person who loves you and cares for you. One day, you may realize you've lost the moon while counting the stars.",ignore person loves cares day realize 've lost moon counting stars,3/19/2013 8:45:55,0.499984,S2_Feeling_Down
313925755358814210,Don't fall for the wrong person just because they know how to say the right things.,fall wrong person things,3/19/2013 8:11:47,0,S2_Feeling_Down
313850330133712896,I hate when people sit in front of you at movies &amp; take away your foot rest.,hate people sit front movies amp foot rest,3/19/2013 3:12:04,-0.769952,S2_Feeling_Down
313848969887375360,Sometimes I wish you were in my place just to know how I feel.,place feel,3/19/2013 3:06:40,-0.239002,S2_Feeling_Down
313848323444469760,"Protect those who mean the most to you and never turn back on them. In the end, they're the ones who will stand by you",protect turn y're stand,3/19/2013 3:04:05,0.0520513,S2_Feeling_Down
313782671241277441,"@_Jet_Star same here, i wouldn't know how to use it!! lol",lol,3/18/2013 22:43:13,0,Other
313779999620603904,"When someone takes too long to text me back, I start rereading what I sent to see what I might've said wrong.",takes text start rereading 've wrong,3/18/2013 22:32:36,-0.690439,S2_Feeling_Down
313777765944012800,"We don't lose friends, we just learn who our real ones are.",lose friends learn,3/18/2013 22:23:43,0.506002,Other
313741501186322432,Drunk words are sober thoughts.,drunk sober thoughts,3/18/2013 19:59:37,-0.396308,S2_Feeling_Down
313630525124399104,@JaLisaMarieeee of course following now,,3/18/2013 12:38:38,0.472841,Other
313353614741602304,@Darkidolmatrix are you calling me selfish!!,calling selfish,3/17/2013 18:18:18,0,S2_Feeling_Down
313265086758277120,I really hate it when I'm in a good mood and suddenly something bad happens and ruins everything.,hate good mood suddenly bad ruins,3/17/2013 12:26:31,-0.901095,S2_Feeling_Down
313250542967222272,@darciewbu haha love it!,haha love,3/17/2013 11:28:44,0.872355,Other
313236920685703168,"Never give up on something you really want. It’s difficult to wait, but worse to regret.",difficult wait worse regret,3/17/2013 10:34:36,-0.445391,S2_Feeling_Down
313236709494124544,I miss the way we used to talk.,talk,3/17/2013 10:33:45,-0.807899,Other
313217415494381568,@NOTBRYANKING are you sure it's not her screaming lol,screaming lol,3/17/2013 9:17:05,0,Other
313212537619484673,@compelledlife i know it's just plain rude!!,plain rude,3/17/2013 8:57:42,-0.720991,Other
313204269308338176,@MebaCassey_29 aw thankyou your very kind&lt;3,aw thankyou kind lt3,3/17/2013 8:24:51,0.401433,Other
313202665096110080,RT @MebaCassey_29: @crakkmeup95 Gosh! You have the mOst amazing tweets! I love it! xx,gosh amazing tweet love xx,3/17/2013 8:18:29,0.745498,Other
313199971983835136,Thanks for texting me first and then ignoring my reply!!!,texting ignoring reply,3/17/2013 8:07:46,0.682041,S2_Feeling_Down
313167098123800576,@AislingIsobel know the feeling hun mine was more than 2! Stay strong sweetheart&lt;3,feeling hun stay strong sweetheart lt3,3/17/2013 5:57:09,0.0422637,S2_Feeling_Down
313159806796066816,"I hate when I forget to press send on my phone, then sit and wait there for a reply like an idiot.",hate forget press send phone sit wait reply idiot,3/17/2013 5:28:10,-0.557323,S2_Feeling_Down
313159424179073025,Two days is not enough time for a weekend.,days time weekend,3/17/2013 5:26:39,-0.65085,S2_Feeling_Down
313142748708483072,Hope everyone has a wonderfull Sunday. Stay safe and enjoy the day xox,hope wonderfull sunday stay safe enjoy day xox,3/17/2013 4:20:23,0.727849,S2_Feeling_Down
313141568456519680,"Accept me at my strongest, support me at my weakest.",accept strongest support weakest,3/17/2013 4:15:42,0.735382,S2_Feeling_Down
313125963229716480,@Unwanted_72 love you too sweetheart&lt;3,love sweetheart lt3,3/17/2013 3:13:41,0.669591,Other
313125275909107716,"@Unwanted_72 hey beautifull every one would care because u a very muched loved, be strong hum im always here if u need to talk just dm me&lt;3",hey beautifull care loved strong hum talk dm melt3,3/17/2013 3:10:58,0.837802,Other
313029988549021696,@Darkidolmatrix that was ages ago! Just wanted to know because some people use different profiles  * cough* *cough* your very cute,ages wanted people profiles cough cough cute,3/16/2013 20:52:19,0.302401,Other
313018995810897920,"I’m officially done trying. If you want me in your life, you can come find me. Until then, continue treating me like I don’t exist.",officially life find continue treating dont exist,3/16/2013 20:08:38,0,S1_little_interest
312975762460385280,"I like to pretend that everything is alright because when everybody else thinks your fine, sometimes you forget for a while that your not.",pretend alright thinks fine forget,3/16/2013 17:16:51,0.426441,S2_Feeling_Down
312884260640010240,"Respect people's feelings. Even if it doesn't mean anything to you, it could mean everything to them",respect people feelings,3/16/2013 11:13:15,-0.00651342,Other
312880347652182016,"I don’t have trust issues, it’s just that people don’t make themselves trustworthy anymore.",dont trust issues people dont trustworthy,3/16/2013 10:57:42,0,S2_Feeling_Down
312876751959232512,"@want2bedeadnow yes i would, and i do understand please stay strong&lt;3",understand stay strong lt3,3/16/2013 10:43:25,0.403267,Other
312875906601455618,@want2bedeadnow please im here and care about you. Please keep strong. I'm always here for a chat&lt;3,care strong chat lt3,3/16/2013 10:40:03,0.266185,Other
312868176486625280,"Sometimes you just got to be strong. It may hurt and you may shed a few tears, but every thing's going to be alright.",strong hurt tears thing alright,3/16/2013 10:09:20,0.429508,S2_Feeling_Down
312849722379481088,"@SH_LC  um well thats how Australians spell it! ""cough"" ""cough"" Now i had to delete it! Now i know yr watchin i'll try a little harder ""NOT""",um australians spell cough cough delete yr watch harder,3/16/2013 8:56:00,-0.190318,Other
312769128681336832,"that's the thing about pain, it demands to be felt.",thing pain demands felt,3/16/2013 3:35:45,-0.652023,S2_Feeling_Down
312767243488485376,why do you feel the need to put people down?,feel people,3/16/2013 3:28:16,-0.749985,S2_Feeling_Down
312760736973733888,@SH_LC mmmm great minds think alike!! xox,mmmm great minds xox,3/16/2013 3:02:25,0.900028,Other
312758015948369921,@SH_LC make sure it's a cuppa tea! Australians wont get that phrase lol,cuppa tea australians phrase lol,3/16/2013 2:51:36,0.0668384,Other
312757386492383234,"If all your going to do is correct my grammar, then please unfollow me!!!",correct grammar follow,3/16/2013 2:49:06,0.349679,S2_Feeling_Down
312755074726240256,"@SH_LC my pleasure hun, it's true :-)",pleasure hun,3/16/2013 2:39:55,0.871814,Other
312749112602800128,"@SH_LC  You also do a wonderful job in helping people. Your words of wisdom inspire all, including me. xox",wonderful job helping people wisdom inspire including xox,3/16/2013 2:16:13,0.831452,Other
312741843261587457,"RT @SH_LC: @AislingIsobel @crakkmeup95 is a great girl to talk to, knows her stuff :)",great girl talk stuff,3/16/2013 1:47:20,0.900438,Other
312741788614012928,Aw thankyou hun your very kind&lt;3 @SH_LC aw  @AislingIsobel,aw thankyou hun kind lt3 aw,3/16/2013 1:47:07,-0.218736,Other
312737845590761472,RT @AislingIsobel: #FF speaks the words Im afraid to @crakkmeup95 don't ever stop.,speaks afraid,3/16/2013 1:31:27,-0.796724,Other
312601320169295874,"I didn't lose a follower, a follower lost me",lose follower follower lost,3/15/2013 16:28:57,-0.588416,Other
312585375539404800,"I hate being the one who always cares about other people's feelings, sometimes I just need someone who can also understand and care for me.",hate cares people feelings understand care,3/15/2013 15:25:35,-0.717344,S2_Feeling_Down
312517719926898688,It hurts when you have someone in your heart but you can’t have them in your arms.,hurts heart arms,3/15/2013 10:56:45,-0.655233,S2_Feeling_Down
312149400417865728,Saying that you're okay is so much easier rather than explaining all the reasons why you're not.,easier explaining reasons,3/14/2013 10:33:11,0.232104,S2_Feeling_Down
312082694446137345,A true friend is someone who can see the truth and pain in you even when you're fooling everyone else.,friend truth pain fooling,3/14/2013 6:08:07,0,S2_Feeling_Down
311985048511463424,"Always remember, that no matter how useless you think you are, you are still someone's reason to smile.",remember matter useless reason smile,3/13/2013 23:40:06,0.717548,S2_Feeling_Down
311939180294967298,It's always amazed me how tough some people get when they're behind a keyboard.,amazed tough people y're keyboard,3/13/2013 20:37:50,0.515036,S2_Feeling_Down
311930236755378176,"Worst feeling in the world is knowing you did the best you could, and it still wasn't good enough.",worst feeling knowing good,3/13/2013 20:02:18,-0.832608,S2_Feeling_Down
311911906086633472,Who else takes out their head phones and listens to them to make sure the music isn't loud enough for everyone to hear?,takes head phones listens music loud hear,3/13/2013 18:49:28,-0.639606,S2_Feeling_Down
311911431698272257,I've got 99 problems and 86 of them are completely made up scenarios in my head that I'm stressing about for absolutely no logical reason.,99 problems 86 completely scenarios head stressing absolutely logical reason,3/13/2013 18:47:35,-0.758769,S2_Feeling_Down
311910421005205504,"Doing something weird and thinking ""This is why I'm single""",weird thinking single,3/13/2013 18:43:34,-0.532105,Other
311905945724805122,@y0ung_death hey hun follow @AntiBullyOps they will also be there for you and will follow you back,hey hun follow follow,3/13/2013 18:25:47,0.492051,Other
311883740748058624,"No matter how good or bad you think life is, wake up each day and be thankful for life. Someone else is fighting to survive.",matter good bad life wake day thankful life fighting survive,3/13/2013 16:57:32,0.5113,S2_Feeling_Down
311853057048723456,It is not important to have a million friends. It is more important to have a friend that stands by you when millions are against you.,friends friend stands millions,3/13/2013 14:55:37,0.144247,S2_Feeling_Down
311851409249288192,"Failures are a part of life. If you don't fail, you'll never learn. If you never learn, you'll never change.",failures life fail 'll learn learn 'll change,3/13/2013 14:49:04,-0.232588,S2_Feeling_Down
311851121612320768,Appearances make impressions but is the personality that makes an impact.,appearances impressions personality impact,3/13/2013 14:47:55,0.761528,Other
311849193083908096,"I don't care if it's 1am, 2am, 3am or 4am.. If you call and I care about you... I'll always answer.",care 1am 2am 3am 4am call care answer,3/13/2013 14:40:16,-0.642069,S2_Feeling_Down
311843804158242816,@agornowicz87  good morning beautifull hope you have a great day xox,good morning beautifull hope great day xox,3/13/2013 14:18:51,0.920277,S2_Feeling_Down
311777683430338562,"@BeFinecutter it means your beautifull with a broken heart and spirit, so stay strong and your heart and spirit will heal xox",beautifull broken heart spirit stay strong heart spirit heal xox,3/13/2013 9:56:06,0.762097,S2_Feeling_Down
311768726464770048,"I'm proud of my heart. It's been played, stabbed, cheated, burned and broken, but somehow still works.",heart played stabbed cheated burned broken works,3/13/2013 9:20:31,0.63688,S2_Feeling_Down
