Tweet_ID,Raw_text,Cleaned_text,Created_at,Sentiment,Annotation
680854161483784192,"I have no reason to be awake.
I don’t talk to anyone.
I don’t do anything productive.",reason awake dont talk dont productive,12/26/2015 20:54:16,0,S3_Sleep_Disorder
680854057624432640,"I don’t feel good.
I don’t feel okay.
I feel like spending every day sleeping.",dont feel good dont feel feel spending day sleeping,12/26/2015 20:53:51,0.6,S3_Sleep_Disorder
680775823452946432,"You smiled to me and I thought: Damn, I’m fucking in love with you.",smiled thought damn fucking love,12/26/2015 15:42:59,0.55,Other
680773185147682816,"You were the girl that made up her mind,
And left me all alone to die.",girl mind die,12/26/2015 15:32:30,0,S9_Suicidal_Thoughts
680770694834204672,https://t.co/JvCQPeGhi1,,12/26/2015 15:22:36,0,Other
680769970675040256,https://t.co/0daWQQabsL,,12/26/2015 15:19:43,0,Other
680769722435112960,"""If my eyes could show my soul, everyone would cry as they see me smile.""",eyes soul cry smile,12/26/2015 15:18:44,0.3,S2_Feeling_Down
680765793676738560,"""Destroy what destroys you""....But what if the thing destroying you is yourself?",destroy destroys thing destroying,12/26/2015 15:03:07,-0.2,S6_Feeling_Bad_About_Yourself
680763859720749056,https://t.co/xWk1kLi9T8,,12/26/2015 14:55:26,0,Other
680748752655781893,I think the most important thing about music is the sense of escape.,thing music sense escape,12/26/2015 13:55:24,0.45,Other
680739496447602688,"@Avril17Al no I'm stupid, they can't love me, they are smart",stupid love smart,12/26/2015 13:18:38,0.3714285714,S2_Feeling_Down
680739267820281856,I can't breath.,breath,12/26/2015 13:17:43,0,S9_Suicidal_Thoughts
680739135502573568,Being alive hurts.....,alive hurts,12/26/2015 13:17:12,0.1,S6_Feeling_Bad_About_Yourself
680739052895735808,I want to kill myself so badly...,kill badly,12/26/2015 13:16:52,-0.7,S9_Suicidal_Thoughts
680738822905315328,I wish I could die now please....,die,12/26/2015 13:15:57,0,S9_Suicidal_Thoughts
680738707968798720,I'm too stupid to be loved....,stupid loved,12/26/2015 13:15:30,-0.05,S2_Feeling_Down
680530352369233922,:( I did it again.....I'm sorry....,,12/25/2015 23:27:34,-0.625,S6_Feeling_Bad_About_Yourself
680477439223566336,You are something not everyone knows how to love.,love,12/25/2015 19:57:18,0.5,S2_Feeling_Down
680477109412884480,Learning that you don’t care about me was one of the hardest things i’ve had to go through.,learning dont care hardest things ive,12/25/2015 19:56:00,0,S2_Feeling_Down
680476969163714561,"Sometimes, i pretend you love me.",pretend love,12/25/2015 19:55:26,0.5,Other
680476636198887426,I care about your feelings more than mine....,care feelings,12/25/2015 19:54:07,0.5,Other
680476280891019264,It’s became a eveyday-thing to wear long sleeves,eveydaything wear sleeves,12/25/2015 19:52:42,-0.05,S9_Suicidal_Thoughts
680474113144664064,"""What if I jump off that building? Would anyone really care? Would anyone even notice? I don't think so....""",jump building care notice,12/25/2015 19:44:05,0.2,S9_Suicidal_Thoughts
680472592227151872,"""It’s okay to let yourself feel."" 
What if I'm empty? What should I feel?",feel empty feel,12/25/2015 19:38:03,0.2,S6_Feeling_Bad_About_Yourself
680472157961457665,"me: *says completely obscure fact about a murderer*
everyone: *stares and walks away*
me: nice.",completely obscure fact murderereveryone stares walks awayme nice,12/25/2015 19:36:19,0.35,Other
680457646655320065,You only care when it's convenient...,care convenient,12/25/2015 18:38:39,0,Other
680419616431161344,Merry Christmas everyone and happy holidays! :) Stay safe and have a nice day x,merry christmas happy holidays stay safe nice day,12/25/2015 16:07:32,0.65,Other
680419494708277248,Maybe we feel empty because we leave pieces of ourselves in everything we used to love.,feel empty leave pieces love,12/25/2015 16:07:03,0.2,Other
680418829592313857,I'm afraid someone is going to make you happier than I can.,afraid happier,12/25/2015 16:04:25,-0.6,S2_Feeling_Down
680110050808066048,"I oscillate between thinking I am crazy, and thinking I am not crazy enough.",oscillate thinking crazy thinking crazy,12/24/2015 19:37:26,-0.1,Other
680107732238766080,"When you read a book, you hold another’s mind in your hands.",read book hold anothers mind hands,12/24/2015 19:28:13,0,Other
680107554823888896,My heart is so tired,heart tired,12/24/2015 19:27:31,-0.4,S4_lassitute
680106728323706880,My problem was that no one ever needed me as much as I needed them.,problem,12/24/2015 19:24:14,0.2,S2_Feeling_Down
680106265222201346,*me flirting* hey wanna suffer together,flirting hey suffer,12/24/2015 19:22:24,0,Other
680105894026326016,"I hate eating

I hate eating

I hate food

I hate gaining

I hate my body",hate eatingi hate eatingi hate foodi hate gainingi hate body,12/24/2015 19:20:55,-0.8,S5_Eating_Disorder
680105543860531200,"No, you don’t understand . It’s like everything breaks into a million pieces.",dont understand breaks pieces,12/24/2015 19:19:32,0,S2_Feeling_Down
680104967848472576,"My mind: don’t be clingy. Don’t be clingy. Don’t be clingy. Don’t be clingy. Don’t be clingy. Don’t be clingy. Don’t be clingy.

Me: clingy",mind dont clingy dont clingy dont clingy dont clingy dont clingy dont clingy dont clingy clingy,12/24/2015 19:17:14,0,S2_Feeling_Down
680104796787978240,"People will leave you because you’re too much to handle, even if they do actually love you.",people leave handle love,12/24/2015 19:16:33,0.35,S2_Feeling_Down
680077457949618176,I hope one day you’re as happy as you’re pretending to be.,hope day happy pretending,12/24/2015 17:27:55,0.8,Other
680077075433283584,"No matter how much the truth hurts, it’s always better than being lied to.",matter truth hurts lied,12/24/2015 17:26:24,0.35,Other
679828018278350848,@Unneededbody :( it was the day of birth of my love...,day birth love,12/24/2015 0:56:44,-0.125,Other
679825350814265348,"19-12-2015 
saddest day ever......",19122015 saddest day,12/24/2015 0:46:08,0,S2_Feeling_Down
679822889026228224,@Unneededbody hey....idk,hey idk,12/24/2015 0:36:21,0,Other
679815747443490817,I love you,love,12/24/2015 0:07:59,0.5,Other
679777742246797313,You deserve the world and so much more. More than me.,deserve,12/23/2015 21:36:58,0.5,S2_Feeling_Down
679774348706721792,"Every time I think I am finally over you, somehow you have a way of reminding me I’m not.",time finally reminding,12/23/2015 21:23:28,0,Other
679774180670337024,"I just can’t be happy in this society and reality, that I live in.",happy society reality live,12/23/2015 21:22:48,0.4681818182,S2_Feeling_Down
679773660752797696,"You promised you’d never leave, but you left. please come back. I can’t do this without you.",promised leave,12/23/2015 21:20:44,0,Other
679773273522081797,"""I promise.""",promise,12/23/2015 21:19:12,0,Other
679773051240714240,"One day, in retrospect, the years of struggle will strike you as the most beautiful.",day retrospect years struggle strike beautiful,12/23/2015 21:18:19,0.675,Other
679772786181705729,I was fine before you walked into my life.,fine walked life,12/23/2015 21:17:16,0.4166666667,Other
679772672918700032,I am made of untameable demons and unfillable voids.,untameable demons unfillable voids,12/23/2015 21:16:49,0,S2_Feeling_Down
678722037276364800,I guess my problem is that I’m afraid of being rejected so I reject everyone instead.,guess problem afraid rejected reject,12/20/2015 23:41:58,-0.6,S2_Feeling_Down
678715120235757568,It’s not over until I can look you in the eyes and not fall in love all over again,eyes fall love,12/20/2015 23:14:29,0.5,Other
678713794269470721,How can emptiness be so heavy?,emptiness heavy,12/20/2015 23:09:13,-0.2,Other
677857234395754497,You’re not a bad person for the ways you tried to kill your sadness.,bad person ways kill sadness,12/18/2015 14:25:33,0.35,Other
676866977697169412,“stop thinking about it” wow thank u I am cured u should write a book,thinking wow cured write book,12/15/2015 20:50:37,0.1,S2_Feeling_Down
676866504466411520,"""You walk around trying to fix everything but you’re the one who’s broken.""",walk broken,12/15/2015 20:48:44,-0.4,S2_Feeling_Down
676866388087083008,"""Your voice.. It just feels like home. I miss it. I miss all of you so much.""",voice feels,12/15/2015 20:48:17,0.2,S2_Feeling_Down
676866287499276288,Emotionally it feels like I’ve been thrown out of a moving car,emotionally feels ive thrown moving car,12/15/2015 20:47:53,0,S2_Feeling_Down
676866224626634756,"You never apologized to me for hurting me, but I apologized to you 12 times for being angry about it.",apologized hurting apologized 12 times angry,12/15/2015 20:47:38,-0.5,Other
676863190639210504,"""Experience is what you get when you didn’t get what you wanted.""",experience didnt wanted,12/15/2015 20:35:34,0,S2_Feeling_Down
676531971946885120,https://t.co/kCsD42ONr6,,12/14/2015 22:39:26,0,Other
676531582627356672,fuck it.....fuck the world....fuck everything....,fuck fuck fuck,12/14/2015 22:37:53,-0.4,S2_Feeling_Down
676530966534443008,"Damn
0 days clean....
Why now?",damn0 days clean,12/14/2015 22:35:26,0.3666666667,S9_Suicidal_Thoughts
676085777487560704,Sometimes I think it'd be better for everyone if I just didn't wake up tomorrow.,wake tomorrow,12/13/2015 17:06:25,0.5,S9_Suicidal_Thoughts
676082471847481345,You are allowed to outgrow people.,allowed outgrow people,12/13/2015 16:53:16,0,Other
676082307531436032,"Tonight I am sad
tonight I am lonely
the demons are screaming
and I need you to hold me.",tonight sadtonight lonelythe demons screamingand hold,12/13/2015 16:52:37,-0.3,S2_Feeling_Down
676081597066686464,Some of us are not meant to be loved.,meant loved,12/13/2015 16:49:48,0.7,S2_Feeling_Down
675828456941346816,"@SuicidalIdeas I'ts ""no"" it isn't ""not""",i'ts,12/13/2015 0:03:55,0,Other
675826896207261697,"I really, really, really want to die....may I?",die,12/12/2015 23:57:42,0.2,S9_Suicidal_Thoughts
675824731577257984,Ur so damn cute,ur damn cute,12/12/2015 23:49:06,0.5,Other
675821939722731520,I need your help.,,12/12/2015 23:38:01,0,Other
675820606869385216,I need loud music.,loud music,12/12/2015 23:32:43,0.1,Other
675819329460531201,I wanna hold you close....,hold,12/12/2015 23:27:38,0,Other
675817277258866688,I miss your smell....,smell,12/12/2015 23:19:29,0,Other
675730067478155265,I love you,love,12/12/2015 17:32:57,0.5,Other
675726666107387904,"I know I’m worthless.
I know I’m fat.
I know the world is better off without me.
You don’t have to say it because I already know.",worthless fat dont,12/12/2015 17:19:26,-0.15,S6_Feeling_Bad_About_Yourself
675726201458171904,It’s strange how dreams get under your skin and give your heart a test for what’s real and what’s imaginary.,strange dreams skin heart test imaginary,12/12/2015 17:17:35,0.075,Other
675726128158494721,"I’m intoxicated with madness, I’m in love with my sadness.",intoxicated madness love sadness,12/12/2015 17:17:17,0.5,S6_Feeling_Bad_About_Yourself
675726032083812352,It’s hard to tell yourself you’ll be okay if you don’t believe it.,youll dont,12/12/2015 17:16:55,0.1041666667,Other
675725328543780868,"I’m sorry, I’m awful, I’ve just felt so terribly destructive all week. It’s awful. I’m horrible.",awful ive felt terribly destructive week awful horrible,12/12/2015 17:14:07,-0.82,Other
675700202104336384,I've got a war in my mind.,war mind,12/12/2015 15:34:16,0,S7_Concentration_Problems
675699988417142784,"-What's the problem?
-Myself",problem,12/12/2015 15:33:25,0,S2_Feeling_Down
675065989525061632,Why......I'm so damn stupid.....why have I done that?! I just made her suffer...,damn stupid suffer,12/10/2015 21:34:08,0,S2_Feeling_Down
675064649369460736,Just kill me....I can't take this anymore...,kill,12/10/2015 21:28:49,0,S9_Suicidal_Thoughts
675055470030290944,@KimberlyHolas but their opinions are right,opinions,12/10/2015 20:52:20,0.2857142857,Other
674722404686553088,Im sorry.....again... damn im so shitty,damn shitty,12/9/2015 22:48:51,0,S2_Feeling_Down
674685639661588480,@KimberlyHolas well they only gave their opinion,opinion,12/9/2015 20:22:46,0,Other
674340280175341569,I don't wanna hurt u anymore....,hurt,12/8/2015 21:30:26,0,S2_Feeling_Down
674337047746904065,:( I'm sorry.....,,12/8/2015 21:17:35,-0.625,S2_Feeling_Down
674334466031136768,"@redjon634 :/ no u dont, u dont suck at life.",dont dont suck life,12/8/2015 21:07:19,-0.25,Other
674334033883635712,Please I need to hear ur voice again....,hear ur voice,12/8/2015 21:05:36,0,Other
674332040322527233,You're my sunshine...,sunshine,12/8/2015 20:57:41,0,Other
674330948784271360,I love you so much....If I kill myself I wont hurt you anymore right?,love kill hurt,12/8/2015 20:53:21,0.3928571429,S9_Suicidal_Thoughts
674329860144291845,I'm so worthless......I love her.....,worthless love,12/8/2015 20:49:01,0.5,S2_Feeling_Down
674325671372566529,The only reason I haven't killed yet is that I don't to hurt her.....,reason killed hurt,12/8/2015 20:32:23,-0.1,S9_Suicidal_Thoughts
674324791957053441,@AnxietySelfharm I dont know.....,dont,12/8/2015 20:28:53,0,S6_Feeling_Bad_About_Yourself
674311827451432961,@AnxietySelfharm ´well its true i suck,suck,12/8/2015 19:37:22,0.35,S2_Feeling_Down
674307601727901697,Why should I kill myself?,kill,12/8/2015 19:20:34,0,S9_Suicidal_Thoughts
674238519670370304,@silkethekatycat if you dont like it just block me. this is not for you. -.-,dont block,12/8/2015 14:46:04,0,Other
674236545369546752,I feel like i’m bothering you when i talk to you.,feel bothering talk,12/8/2015 14:38:13,0,S2_Feeling_Down
674208345650253824,"I miss your touch, I miss your voice......I miss your heat.....",touch voice heat,12/8/2015 12:46:10,0,Other
674203945464672256,Damn https://t.co/LXfwy3bFOz,damn,12/8/2015 12:28:41,0,Other
674203862895607809,https://t.co/iPmYg5V6xD,,12/8/2015 12:28:21,0,Other
674006488936030208,When I don't say anything that's when it really hurts.,hurts,12/7/2015 23:24:04,0.2,S2_Feeling_Down
674005898008899584,Sorry.....,,12/7/2015 23:21:43,-0.5,S2_Feeling_Down
674005534505324545,I'm so worthless...,worthless,12/7/2015 23:20:16,-0.8,S6_Feeling_Bad_About_Yourself
674003012843630593,I love you....,love,12/7/2015 23:10:15,0.5,Other
673997236330758144,I need to hold you....I need to hug you.....,hold hug,12/7/2015 22:47:18,0,Other
673997121180311553,I need to talk with you....,talk,12/7/2015 22:46:50,0,S2_Feeling_Down
673996759539056640,I feel so lost without you.....,feel lost,12/7/2015 22:45:24,0,S7_Concentration_Problems
673995453923504129,@reallywantt0die yes........its true,,12/7/2015 22:40:13,0.35,Other
673994661820817408,@reallywantt0die I'm a waste of space.......so if I keep eating I will waste more space....,waste space eating waste space,12/7/2015 22:37:04,0.0333333333,S5_Eating_Disorder
673993938202677252,What if there's no more hope?,hope,12/7/2015 22:34:11,-0.25,S2_Feeling_Down
673993611420295169,My mind scares me sometimes....,mind scares,12/7/2015 22:32:53,0,Other
673993416326410240,@reallywantt0die but.......,,12/7/2015 22:32:07,0,Other
673992304143769600,"me-""OMG A CAR HIT ME""
mind- ""Shut up....that only happens in dreams.""
me-""sorry I forgot it""",meomg car hit memind shut dreams mesorry forgot,12/7/2015 22:27:42,-0.25,S9_Suicidal_Thoughts
673991407548387329,I hate overthinking about everything....,hate overthinking,12/7/2015 22:24:08,-0.8,S7_Concentration_Problems
673989928599035904,Fuck.....I just eated a fucking piece of cake.....should I throw it?,fuck eated fucking piece cake throw,12/7/2015 22:18:15,-0.6,Other
673988983194546178,"I don't wanna take up all your time
'Cause you're such a pretty, pretty, pretty face
But you turned into a pretty big waste of my time",time'cause pretty pretty pretty facebut turned pretty big waste time,12/7/2015 22:14:30,0.1142857143,S2_Feeling_Down
673988788662771714,"""If you can't hang then, there's the door, baby""",hang door baby,12/7/2015 22:13:43,0,S2_Feeling_Down
673985392073449472,"""Violated after death
Virgin hole I infest
Anal pore spewing cess
The sacred juice I ingest
Your death child I defile
Necropedophile""",violated deathvirgin hole infestanal pore spewing cessthe sacred juice ingestyour death child defilenecropedophile,12/7/2015 22:00:14,0,Other
673984420567732224,I know I know I'm a shitty person...can you please stop reminding me of that?,shitty person reminding,12/7/2015 21:56:22,0,S2_Feeling_Down
673982003272941568,I used to feel free to tweet about anything before..but now I don't feel safe anymore....,feel free tweet feel safe,12/7/2015 21:46:46,0.45,S2_Feeling_Down
673976852755664897,@MarErasmus It's time for me to say goodbye.,time goodbye,12/7/2015 21:26:18,0,Other
673976660350394369,And every day it gets harder....,day harder,12/7/2015 21:25:32,-0.1,S2_Feeling_Down
672922517078691840,"@GarnKarneval  yes...my teacher, the only person I would die for....",teacher person die,12/4/2015 23:36:45,0,Other
672921503479013376,@GarnKarneval But im sick of this....she doens't even notices how hard I'm trying....,sick doens't notices,12/4/2015 23:32:43,-0.5029761905,S2_Feeling_Down
672920630963081216,@GarnKarneval I'm too shitty to keep on trying,shitty,12/4/2015 23:29:15,0,S2_Feeling_Down
672918637242642433,@GarnKarneval yes i did,,12/4/2015 23:21:19,0,Other
672918180990439424,@GarnKarneval no I cant,,12/4/2015 23:19:31,0,Other
672915474435411969,"Shut up, shut up, shut up, please, I can't take this anymore....",shut shut shut,12/4/2015 23:08:45,0,S1_little_interest
671827167412658176,@kenziew1116 here 4u2,4u2,12/1/2015 23:04:13,0,Other
671823149516914688,@kenziew1116 :(,,12/1/2015 22:48:15,-0.75,Other
671816539805478913,I hate myself...,hate,12/1/2015 22:21:59,-0.8,S6_Feeling_Bad_About_Yourself
670690238465994752,@LoriG0d yes love it too,love,11/28/2015 19:46:28,0.5,Other
670354379178958848,Maybe that's the answer.....suicide :/,answer suicide,11/27/2015 21:31:53,-0.25,S9_Suicidal_Thoughts
668924390927671296,Why have u lied to me? *sigh*,lied sigh,11/23/2015 22:49:37,0,Other
668918250047152130,Damn.....I fucking love you...but I hate you at the same time...,damn fucking love hate time,11/23/2015 22:25:13,-0.1,Other
668917434582228992,I just feel so damn lost....,feel damn lost,11/23/2015 22:21:58,0,S7_Concentration_Problems
668917340529164289,I should be hating u right now...but I can't....I still love you.....,hating love,11/23/2015 22:21:36,0.3928571429,Other
668916650146680833,Why?,,11/23/2015 22:18:51,0,Other
668916378095755264,@_unknownnx :(,,11/23/2015 22:17:47,-0.75,Other
668908860674088961,I was trusting her....why??,trusting,11/23/2015 21:47:54,0,Other
668908807788077056,I can't take this anymore.....,,11/23/2015 21:47:42,0,S2_Feeling_Down
668905789449457664,I want to end it all,end,11/23/2015 21:35:42,0,S9_Suicidal_Thoughts
668548204179386368,I feel so lonely....,feel lonely,11/22/2015 21:54:47,-0.1,S2_Feeling_Down
668543095257104385,"@WeRNotOurScars it´s just a normal thing....I want to die, like always",normal thing die,11/22/2015 21:34:29,0.15,S9_Suicidal_Thoughts
668213698146787328,@WeRNotOurScars im still alive,alive,11/21/2015 23:45:35,0.1,S9_Suicidal_Thoughts
668205021008367616,@WeRNotOurScars bad :/,bad,11/21/2015 23:11:06,-0.475,Other
667442424239771649,@fleur_du_mal_26 :(,,11/19/2015 20:40:49,-0.75,Other
667129552397836288,@fleur_du_mal_26 what if it doenst?,doenst,11/18/2015 23:57:34,0,Other
667128774790651904,@fleur_du_mal_26 idk......,idk,11/18/2015 23:54:29,0,Other
667125042128494594,"@fleur_du_mal_26 no...""i was born on the wrong place, in the wrong time""",born wrong place wrong time,11/18/2015 23:39:39,-0.5,S2_Feeling_Down
667123361328275456,@fleur_du_mal_26 but i want to,,11/18/2015 23:32:58,0,Other
666399891946676228,@fleur_du_mal_26 Yes I am,,11/16/2015 23:38:10,0,Other
666398141302861824,*sigh,sigh,11/16/2015 23:31:12,0,Other
666398082934943744,I'm going to fucking kill myself,fucking kill,11/16/2015 23:30:58,-0.6,S9_Suicidal_Thoughts
666397992526733312,"I fucking hate my fucking life.
0 fucking days clean",fucking hate fucking life fucking days clean,11/16/2015 23:30:37,-0.4083333333,S6_Feeling_Bad_About_Yourself
665557155777523716,Oh gosh....I love him so much....,gosh love,11/14/2015 15:49:26,0.35,Other
664887918385831940,@zerstxrte_hure  thanks :),,11/12/2015 19:30:07,0.35,Other
664887044188033024,@deadheartsoul :),,11/12/2015 19:26:38,0.5,Other
664886656361721857,1 week and 5 days clean,week days clean,11/12/2015 19:25:06,0.3666666667,S9_Suicidal_Thoughts
661664260024639489,"Fuck, 0 days clean again.....",fuck days clean,11/3/2015 22:00:27,-0.0166666667,S9_Suicidal_Thoughts
660916617879113728,@jalexisreal =((((,,11/1/2015 20:29:35,-0.75,Other
660897046728175616,3 days clean....But I want to cut so badly......,days clean cut badly,11/1/2015 19:11:49,-0.7,S9_Suicidal_Thoughts
660895866484629506,"Damn, I feel so lonely....",damn feel lonely,11/1/2015 19:07:08,-0.1,S2_Feeling_Down
660895284118073344,I´m so fucking weak,fucking weak,11/1/2015 19:04:49,-0.375,S4_lassitute
660880981046534144,I need her so fking much,fking,11/1/2015 18:07:59,0.2,Other
660880642645893120,I feel so damn lost without her :(,feel damn lost,11/1/2015 18:06:38,-0.75,S2_Feeling_Down
660879042426576896,-I want to die *sigh,die sigh,11/1/2015 18:00:16,0,S9_Suicidal_Thoughts
660878693351473152,Maybe I'm just a demon trying to go back to hell....,demon hell,11/1/2015 17:58:53,0,S9_Suicidal_Thoughts
660878334935584772,I wish I was dead....,dead,11/1/2015 17:57:28,-0.2,S9_Suicidal_Thoughts
660166895405047808,People get tired of you being sad.,people tired sad,10/30/2015 18:50:27,-0.45,S4_lassitute
660052320605093888,"School is so boring, just take me out of here please.",school boring,10/30/2015 11:15:11,-1,S1_little_interest
659870983554244608,:( 0 days clean......,days clean,10/29/2015 23:14:36,-0.1916666667,S9_Suicidal_Thoughts
659870701067837440,What if I die today? No one would care about me anyway..,die care,10/29/2015 23:13:29,0,S9_Suicidal_Thoughts
659862564453687296,:( I need her warm hugs.,warm hugs,10/29/2015 22:41:09,-0.075,Other
659861933617774593,"I miss the sound of her voice, I miss her smile, I miss her.",sound voice smile,10/29/2015 22:38:39,0.35,Other
659861752570580992,Fuck she doesn't even look at my face....I fuck everything up.....,fuck face fuck,10/29/2015 22:37:56,-0.4,Other
659697987376037890,"fuck, it hurts.",fuck hurts,10/29/2015 11:47:11,-0.4,Other
659501331565174784,@gypsyfawn_ my mother is a Jehovah Witness.I'm basically forced to go there with her :s,mother jehovah witness basically forced,10/28/2015 22:45:45,-0.275,S1_little_interest
659500330447716352,@gypsyfawn_ whats ur religion?,ur religion,10/28/2015 22:41:46,0,Other
659486826017722368,Oh god I'm sick of this shit....religion is boring....,god sick shit religion boring,10/28/2015 21:48:06,-0.8571428571,S2_Feeling_Down
659486632408686592,I LOVE YOU RUI :3,love rui,10/28/2015 21:47:20,0.5,Other
659486372638695425,Oh god...I need her sooooo much :( I feel like a loner.. Well to be honest I don't even deserve to be alive,god sooooo feel loner honest deserve alive,10/28/2015 21:46:18,0.0375,S2_Feeling_Down
6.59E+17,Those scars on your wrists are the mark of the world....,scars wrists mark,10/27/2015 9:40:04,0,S9_Suicidal_Thoughts
658940796150902784,She hates me so much....,hates,10/27/2015 9:38:22,0.2,S2_Feeling_Down
658937109647085568,Rui &lt;3,rui lt3,10/27/2015 9:23:44,0,Other
658936050346295296,I love you :3 sweetie,love sweetie,10/27/2015 9:19:31,0.5,Other
658760798823710720,"I love you Rui, ur soooo cute, love my baby",love rui ur soooo cute love baby,10/26/2015 21:43:08,0.5,Other
658759406755139584,I love him so much...but is mom is angry with me....and I adore her....,love mom angry adore,10/26/2015 21:37:36,0,Other
658758177685688320,"He is so fucking perfect, I'm in love with his smile, his voice....I'm simply in love with him :3",fucking perfect love smile voice simply love,10/26/2015 21:32:43,0.56,Other
658757925784154112,"I love him so much, but I think he hates me....everyone hates me so...that's okay",love hates hates,10/26/2015 21:31:43,0.4,Other
658756883365384198,Sometimes pain doesn't worth living,pain worth,10/26/2015 21:27:34,0.3,S2_Feeling_Down
658754991394549760,"There comes a point when you either embrace who and what you are, or condemn yourself to be miserable all your days.",point embrace condemn miserable days,10/26/2015 21:20:03,-1,S2_Feeling_Down
658750729230925824,"I want to die, she hates me so damn much...",die hates damn,10/26/2015 21:03:07,0.2,S9_Suicidal_Thoughts
658725838817464321,@lolsouatuacrush nsei :(,nsei,10/26/2015 19:24:13,-0.75,Other
658672734164135937,she hates me....,hates,10/26/2015 15:53:12,0,Other
658644642381103106,I want to die... I feel like shit....,die feel shit,10/26/2015 14:01:34,-0.2,S9_Suicidal_Thoughts
658616508046843904,"Fuck, I'm gona die..... SHE WILL KILL ME TT-TT",fuck gona die kill tttt,10/26/2015 12:09:46,-0.4,S9_Suicidal_Thoughts
658406649871384581,https://t.co/ZWF50EXw3Q,,10/25/2015 22:15:52,0,Other
658399290126110720,I'm useless,useless,10/25/2015 21:46:37,-0.5,S6_Feeling_Bad_About_Yourself
658398567841845249,I'm so fucking weak and worthless.,fucking weak worthless,10/25/2015 21:43:45,-0.5875,S6_Feeling_Bad_About_Yourself
658398479631450112,0 fucking days clean,fucking days clean,10/25/2015 21:43:24,-0.1166666667,S9_Suicidal_Thoughts
658397927967182848,"I want to be alone, but I don't want to be a loner.",loner,10/25/2015 21:41:13,0,S2_Feeling_Down
658397839031148545,I feel lonely.,feel lonely,10/25/2015 21:40:51,-0.1,S2_Feeling_Down
658397470125330432,https://t.co/OFJQ0IWw9e,,10/25/2015 21:39:23,0,Other
