Tweet_ID,Raw_text,Cleaned_text,Created_at,Sentiment,Annotation
642462858824052736,"""I am destroying myself so other people can’t,“ she said, ” and it’s the worst kind of control but it’s the only form I know.""",destroying people worst kind control form,9/11/2015 22:20:56,-0.145,S6_Feeling_Bad_About_Yourself
642457898195517440,I let you in. I fucking let you in and you completely destroyed me.,fucking completely destroyed,9/11/2015 22:01:13,-0.25,S6_Feeling_Bad_About_Yourself
642452970202898432,You were right to call me unstable. I’m a walking fucking disaster.,call unstable walking fucking disaster,9/11/2015 21:41:38,-0.1571428571,S6_Feeling_Bad_About_Yourself
642452755727183872,I think my parents would yell at me if i died,parents yell died,9/11/2015 21:40:47,0,S9_Suicidal_Thoughts
642450921436377088,The reason I talk to myself is because I’m the only one whose answers I accept.,reason talk answers accept,9/11/2015 21:33:30,0,S6_Feeling_Bad_About_Yourself
642450631375110144,"When you are a sassy, fierce human being but low-key want to kill yourself.",sassy fierce human lowkey kill,9/11/2015 21:32:21,0,S9_Suicidal_Thoughts
642449737019473920,"But above all, I wish for your happiness, even though I’m aware you require my absence to find it..",happiness aware require absence find,9/11/2015 21:28:48,0.234375,S6_Feeling_Bad_About_Yourself
642448898779389952,"When it’s over, leave. Don’t continue watering a dead flower.",leave dont continue watering dead flower,9/11/2015 21:25:28,-0.2,S2_Feeling_Down
642448662535270400,"""Someone:You're gonna end up alone because you're too picky
Me:You're gonna end up divorced because you settle for less.""",someoneyou're end pickymeyou're end divorced settle,9/11/2015 21:24:31,-0.1666666667,S6_Feeling_Bad_About_Yourself
642442289386770436,What if eyes could talk?,eyes talk,9/11/2015 20:59:12,0,S2_Feeling_Down
642441786426793984,"Nobody drinks a bottle of vodka for fun, and that’s a damn fact.",nobody drinks bottle vodka fun damn fact,9/11/2015 20:57:12,0.3,S2_Feeling_Down
642441598001938432,Nobody will ever love you quite the way you want them to. You just have to let them do their best.,nobody love,9/11/2015 20:56:27,0.75,S6_Feeling_Bad_About_Yourself
642429209651118080,I cannot count the times I have apologized for how I feel or who I am.,count times apologized feel,9/11/2015 20:07:13,0,S6_Feeling_Bad_About_Yourself
642400557580337152,Life doesn't worth pain.,life worth pain,9/11/2015 18:13:22,0.3,S6_Feeling_Bad_About_Yourself
642321159489495041,"Sorry for leaving you
Sorry for fading
Sorry for bringing your hopes up,
Sorry for everything",leaving yousorry fadingsorry bringing hopes,9/11/2015 12:57:52,-0.5,S6_Feeling_Bad_About_Yourself
642320374835884032,At my funeral please read out my suicide note so everyone can find out just how sorry I am.,funeral read suicide note find,9/11/2015 12:54:45,-0.5,S9_Suicidal_Thoughts
6.42E+17,"""Because, nothing makes me happier and nothing makes me sadder than you.""",nothing happier nothing sadder,9/11/2015 12:26:30,0,Other
641746437353656320,"*it starts raining*
    me:yes
    *lighting appears*
    me:yES
    *thunders explode*
    me:YES
    *raining intensifies*
    me:YES",starts raining meyes lighting appears meyes thunders explode meyes raining intensifies meyes,9/9/2015 22:54:08,0,Other
641736895597293568,@cote_pereira done,,9/9/2015 22:16:13,0,Other
641734076286771201,Repeat this until you understand it: I do not need people who do not need me.,repeat understand people,9/9/2015 22:05:01,0,S2_Feeling_Down
641731206808272896,http://t.co/p9oWhHuRDK,,9/9/2015 21:53:37,0,Other
641730496150523905,I am so fucking sad. And I can’t make it go away. It all hurts and I can’t breathe.,fucking sad hurts breathe,9/9/2015 21:50:47,-0.5,S2_Feeling_Down
641729692484141060,"RT @girldepressionx: I smile
I try
But truth is I want to die",smilei trybut truth die,9/9/2015 21:47:36,0.3,S9_Suicidal_Thoughts
641729648032915456,"""Just remember, even your worst days only have twenty-four hours.""",remember worst days twentyfour hours,9/9/2015 21:47:25,-0.5,S6_Feeling_Bad_About_Yourself
641719250382639104,"""I hate the feeling when you have to say goodbye to someone you want to spend every minute with.""",hate feeling goodbye spend minute,9/9/2015 21:06:06,-0.8,Other
641718953711173632,"""people:i can hear your music
me:you're welcome""",peoplei hear musicmeyou're,9/9/2015 21:04:55,0.8,Other
641717848306515968,Miért bíztam egyáltalán benne?,mirt bztam egyltaln benne,9/9/2015 21:00:32,0,Other
641717189188395008,"""mom:what time did you get out of bed
me:physically or emotionally""",momwhat time bedmephysically emotionally,9/9/2015 20:57:55,0,Other
641715649115475969,"""Death is a liberation because to die is to need no one else.""",death liberation die,9/9/2015 20:51:47,0,S9_Suicidal_Thoughts
641702049864880128,"""Be rough with me. Show me what’s up, throw me against the damn wall and claim what’s yours.""",rough throw damn wall claim,9/9/2015 19:57:45,-0.1,S2_Feeling_Down
641697994170101760,"""-What's the saddest word in english?
-Almost.
-Why?
-I was almost good for her. She was almost in love with me. We almost made it.""",saddest word good love,9/9/2015 19:41:38,0.4,S2_Feeling_Down
641697522403143681,"""I spent so long in the darkness, I’d almost forgotten how beautiful the moonlight is.""",spent darkness forgotten beautiful moonlight,9/9/2015 19:39:46,0.2333333333,S2_Feeling_Down
641697420821270528,"""There was nothing to talk about anymore. The only thing to do was go.""",nothing talk thing,9/9/2015 19:39:21,0,S6_Feeling_Bad_About_Yourself
641589440524218368,@br0kentiger nope,nope,9/9/2015 12:30:17,0,S2_Feeling_Down
641586361225625600,"If you could be anyone, would you choose to be yourself?",choose,9/9/2015 12:18:03,0,S6_Feeling_Bad_About_Yourself
641586111748378624,"""I know that I’m nothing special. But oh how I wish to be important to you.""",nothing,9/9/2015 12:17:03,0.3785714286,S6_Feeling_Bad_About_Yourself
641585333944102912,"""Me trying to express how I feel:Idk I just feel like...idk...idk man. Nvm I'm good.""",express feelidk feel idk idk man nvm good,9/9/2015 12:13:58,0.7,S2_Feeling_Down
641397744851136512,I'm not good enough.,good,9/8/2015 23:48:33,-0.175,S6_Feeling_Bad_About_Yourself
641389127640969216,RT @ssuicidalgirl: Wanna die tonight,die tonight,9/8/2015 23:14:19,0,S9_Suicidal_Thoughts
641386031510614016,"“You’ll be okay.”
Yeah, that’s what I’ve been told for years.",youll yeah ive told years,9/8/2015 23:02:00,0.5,S6_Feeling_Bad_About_Yourself
641373337910935552,I just wanna feel okay again.,feel,9/8/2015 22:11:34,0.5,S6_Feeling_Bad_About_Yourself
641260531148562432,"""Close your eyes, it’s time to feel.""",eyes time feel,9/8/2015 14:43:19,0,S2_Feeling_Down
641260135780884480,"""If your compassion does not include yourself, it is incomplete.""",compassion include incomplete,9/8/2015 14:41:45,0,S6_Feeling_Bad_About_Yourself
641258800289333248,"What would you ask for, if you knew the answer was Yes?",knew answer,9/8/2015 14:36:26,0,S6_Feeling_Bad_About_Yourself
641257841756635136,I’ve become everything I said I’d never be.,ive,9/8/2015 14:32:38,0,S2_Feeling_Down
641257762907922432,The best way to pretend you’re not hurt is to laugh.,pretend hurt laugh,9/8/2015 14:32:19,0.65,S6_Feeling_Bad_About_Yourself
640974132214145024,RT @QuotesDeDeb: I hate me. I hate me. I hate me. I hate me. I hate me. I hate me. I hate me. I hate me. I hate me. I hate me. I hate me.I …,hate hate hate hate hate hate hate hate hate hate hate,9/7/2015 19:45:16,-0.8,S6_Feeling_Bad_About_Yourself
640973475855863808,"I know that our paths will never cross again. And gosh, it hurts.",paths cross gosh hurts,9/7/2015 19:42:40,0,S6_Feeling_Bad_About_Yourself
640971794887909376,I just feel so damn fucking dead inside.,feel damn fucking dead,9/7/2015 19:35:59,-0.2,S2_Feeling_Down
640971442721570816,Sometimes it’s better not to look back.,,9/7/2015 19:34:35,0.25,S6_Feeling_Bad_About_Yourself
640970418988392452,"The loneliest moment in someone’s life is when they are watching their whole world fall apart, and all they can do is stare blankly.",loneliest moment someones life watching fall stare blankly,9/7/2015 19:30:31,0.1,S6_Feeling_Bad_About_Yourself
640969395565645824,"""Whatever you do, good or bad, people will always have something negative to say.""",good bad people negative,9/7/2015 19:26:27,-0.1,S2_Feeling_Down
640631098461024256,How do you wake up from a nightmare if you're not asleep?,wake nightmare asleep,9/6/2015 21:02:10,0,S2_Feeling_Down
640627614005231616,http://t.co/sLcxRk1yqR,,9/6/2015 20:48:20,0,Other
640625779131445248,I don't know what do anymore.,,9/6/2015 20:41:02,0,S6_Feeling_Bad_About_Yourself
640621033108697088,"Sometimes,
all you can do
is lie in bed,
and hope
to fall asleep
before
you fall apart.",dois lie bed hopeto fall asleepbeforeyou fall,9/6/2015 20:22:11,0,S6_Feeling_Bad_About_Yourself
640617545221992448,"No more expectations. Just gonna go with the flow and whatever happens, happens.",expectations flow,9/6/2015 20:08:19,-0.25,S2_Feeling_Down
640596228363919360,You don’t have to save me. Just hold my hand while I save myself.,dont hold hand,9/6/2015 18:43:37,0,S2_Feeling_Down
640526548848787456,"Johnnie Guilbert - ""Not So Perfect"" Original Song https://t.co/hkVpY49Cp8 via @YouTube
@JohnnieGuilbert",johnnie guilbert perfect original song,9/6/2015 14:06:44,0.6875,Other
640297420379832320,You can't escape a problem which only exists in your head.,escape problem exists head,9/5/2015 22:56:15,0,S6_Feeling_Bad_About_Yourself
640296742370471936,"Look at your cuts.
Or your burns.
Or those bruises you gave yourself.
Each one, is a battle with yourself that you lost",cuts burns bruises battle lost,9/5/2015 22:53:34,0,S9_Suicidal_Thoughts
640294254640824320,"I drove myself insane trying to figure out who you are.
And I’ve destroyed parts of myself to get a taste of what I wished was love.",drove insane figure ive destroyed parts taste wished love,9/5/2015 22:43:41,-0.25,Other
640293597355577344,"- I just want to sleep forever
- But isn't that just like death?
- Yeah.
- So you want to die?
- Yeah, that's the point",sleep forever death yeah die yeah point,9/5/2015 22:41:04,0,S9_Suicidal_Thoughts
640271355582251008,"When I die don't you dare come to my funeral, 'cause i'ts too late....",die funeral 'cause i'ts late,9/5/2015 21:12:41,-0.3,S9_Suicidal_Thoughts
640270047752101888,How you make others feel about themselves says a lot about you.,feel lot,9/5/2015 21:07:29,0,S6_Feeling_Bad_About_Yourself
640261915609055232,I ruin everything I touch...,ruin touch,9/5/2015 20:35:10,0,S2_Feeling_Down
640258294913835008,"Sometimes I’m really scared. Scared of myself. The things I do, the thoughts I have. I don’t recognize myself anymore.",scared scared things thoughts dont recognize,9/5/2015 20:20:47,0.2,S6_Feeling_Bad_About_Yourself
640251753317953536,"I really do want to be happy again, but who I am without these feelings? Can I ever really be happy? Was I ever happy to begin with?",happy feelings happy happy,9/5/2015 19:54:47,0.65,S2_Feeling_Down
640251492612591617,I feel so empty...,feel empty,9/5/2015 19:53:45,-0.1,S6_Feeling_Bad_About_Yourself
640228669504520192,@garnkarneval shut up dumbass. ur not doing anything stay here and later we talk,shut dumbass ur stay talk,9/5/2015 18:23:04,0,S2_Feeling_Down
640174710140063744,"Fuck you, I post whatever I want.....This is my account if u dont like it unfollow me",fuck post account dont unfollow,9/5/2015 14:48:39,-0.4,Other
640174167506219008,@Prismaticphan or dont see,dont,9/5/2015 14:46:30,0,Other
640174105694744577,@Prismaticphan if u dont like dont follow,dont dont follow,9/5/2015 14:46:15,0,Other
640173809014820865,@Prismaticphan i dont romantize them,dont romantize,9/5/2015 14:45:04,0,Other
639938798785306624,I'm just a cretin,cretin,9/4/2015 23:11:13,0,Other
639936576315916288,I was interested in everything and committed to nothing.,interested committed nothing,9/4/2015 23:02:23,0.25,S6_Feeling_Bad_About_Yourself
6.40E+17,"People change,
things go wrong,
shit happens,
but life goes on.",people change things wrong shit life,9/4/2015 22:51:01,-0.35,Other
639933496539148288,@Avril17Al ily2,ily2,9/4/2015 22:50:09,0,Other
639931933061971968,@Avril17Al thnks,thnks,9/4/2015 22:43:56,0,Other
639929539469119488,@Avril17Al :(,,9/4/2015 22:34:26,-0.75,Other
639928292364152832,I’m such a fucking disappointment.,fucking disappointment,9/4/2015 22:29:28,-0.3,S6_Feeling_Bad_About_Yourself
639927984498024448,@Br0k3n1nSaNiTy :(,,9/4/2015 22:28:15,-0.75,Other
639927859612676096,Oh how I wish I had the words to translate the mess in my mind.,translate mess mind,9/4/2015 22:27:45,-0.175,S6_Feeling_Bad_About_Yourself
639901444884312064,"Then suddenly you’re left all alone
with your body that can’t love you
and your will that can’t save you.",suddenly alonewith body love youand,9/4/2015 20:42:47,0.1666666667,S2_Feeling_Down
639899443471458304,"I like it when it rains hard. It sounds like white noise everywhere, which is like silence but not empty.",rains sounds white noise silence empty,9/4/2015 20:34:50,-0.0805555556,S6_Feeling_Bad_About_Yourself
639899282670272513,Don’t set yourself on fire to keep others warm.,dont set fire warm,9/4/2015 20:34:12,0.6,S2_Feeling_Down
639898500465995776,"""I know that I can survive. I’ll walk through fire to save my life. I want it, I want my life so bad. I’m doing everything I can.""",survive walk fire life life bad,9/4/2015 20:31:05,-0.6,S6_Feeling_Bad_About_Yourself
639896563918196737,"Unexpressed emotions will never die. They are buried alive and they will come forth, later, in uglier ways.",unexpressed emotions die buried alive uglier ways,9/4/2015 20:23:24,0.05,Other
639769122058956800,"You don't care, you're just being nice...",care nice,9/4/2015 11:56:59,0.6,S6_Feeling_Bad_About_Yourself
639763936007614464,@avarg12san hi ^^,,9/4/2015 11:36:23,0,Other
639577906524631040,I'm a loner.,loner,9/3/2015 23:17:10,0,S6_Feeling_Bad_About_Yourself
639575626689720320,"Walk away to end the world, with false hope in a false god, walk away to end the world, with false hope in you.",walk end false hope false god walk end false hope,9/3/2015 23:08:06,-0.4,S2_Feeling_Down
639575086337511425,hi is there any girl who wants to be my best friend? I'm alone,girl friend,9/3/2015 23:05:57,0.6,S2_Feeling_Down
639572940611260416,Please murder me,murder,9/3/2015 22:57:26,0,S2_Feeling_Down
639567994843176960,http://t.co/iJk78oa7Nz,,9/3/2015 22:37:47,0,Other
639567125699502080,I know I’m going to regret that but who cares.,regret cares,9/3/2015 22:34:20,0,S6_Feeling_Bad_About_Yourself
639566426127273984,I promise you my pain wasn’t poetic. It was days without sleep and pretending I was stable enough to continue.,promise pain poetic days sleep pretending stable continue,9/3/2015 22:31:33,0.1875,S6_Feeling_Bad_About_Yourself
639538727270879232,"You can erase it, but you can never really forget it.",erase forget,9/3/2015 20:41:29,-0.1,S6_Feeling_Bad_About_Yourself
639446213390147584,Sometimes suicide is your last choice.,suicide choice,9/3/2015 14:33:52,0,S9_Suicidal_Thoughts
639445807847108608,RT @suicidalenough: I want to scream,scream,9/3/2015 14:32:15,0,S2_Feeling_Down
639445770186424320,RT @Just_KillMeNow_: Depression has a way of completely changing you as a person from one day to another.,depression completely changing person day,9/3/2015 14:32:06,0.1,Other
639414605543002112,RT @cxnfusedsht: now we're screaming just to see who's louder,screaming louder,9/3/2015 12:28:16,0,Other
639406353937760257,"It was nice having friends, but now they’ve all left.",nice friends theyve,9/3/2015 11:55:29,0.3,S6_Feeling_Bad_About_Yourself
639406098148126720,Recovery is terrifying when you don’t know who you are without your sadness.,recovery terrifying dont sadness,9/3/2015 11:54:28,-1,S2_Feeling_Down
639388810820886528,:) https://t.co/n3aSAmdhN0,,9/3/2015 10:45:46,0.5,Other
639230998857805824,Today is a good day to die,good day die,9/3/2015 0:18:41,0.7,S9_Suicidal_Thoughts
639230232994705408,Overthinking seriously kills you.,overthinking kills,9/3/2015 0:15:38,-0.3333333333,S7_Concentration_Problems
639230183963262976,The future scares me…. But then it excites me.,future scares excites,9/3/2015 0:15:26,0,S6_Feeling_Bad_About_Yourself
639229548538777600,How many times do we say we don’t care but deep down we fucking care so fucking much.,times dont care deep fucking care fucking,9/3/2015 0:12:55,-0.0111111111,S6_Feeling_Bad_About_Yourself
639227884389990400,"Honestly I’m not quite sure where I belong yet, and I’m afraid in 15 years I’ll still be saying the same thing.",honestly belong afraid 15 years thing,9/3/2015 0:06:18,-0.18,S2_Feeling_Down
639226529961115648,"I fking miss you, I think right now u would be ashamed of me",fking ashamed,9/3/2015 0:00:55,0.2857142857,S2_Feeling_Down
639226416568078336,I miss you daddy....,daddy,9/3/2015 0:00:28,0,Other
639224550299975680,"I miss you daddy, it's been 5 years",daddy years,9/2/2015 23:53:03,0,Other
639223082092261377,@GarnKarneval nope,nope,9/2/2015 23:47:13,0,Other
639222263892582400,@GarnKarneval no one can help me...only my blades and a rope,blades rope,9/2/2015 23:43:58,0,S9_Suicidal_Thoughts
639221379624271873,@GarnKarneval i want to die,die,9/2/2015 23:40:27,0,S9_Suicidal_Thoughts
639220628395065345,"@GarnKarneval in this second,maybe ill die in the next minute",die minute,9/2/2015 23:37:28,-0.25,S9_Suicidal_Thoughts
639220012717318145,Just because one person’s problem is less traumatic than another’s doesn’t mean they’re required to hurt less.,persons problem traumatic anothers doesnt required hurt,9/2/2015 23:35:01,-0.2152777778,S6_Feeling_Bad_About_Yourself
639219679056293889,@GarnKarneval yes it is,,9/2/2015 23:33:42,0,Other
639219168294907905,"@GarnKarneval i'm just a fcking mess, wbu?",fcking mess wbu,9/2/2015 23:31:40,-0.175,S6_Feeling_Bad_About_Yourself
639219071515557892,You stabbed me a thousand times and then acted like you were the one that was bleeding,stabbed times acted bleeding,9/2/2015 23:31:17,0,S2_Feeling_Down
639218393632108545,"And I’ve been sitting at the bottom of the swimming pool,
for a while now,
drowning out my thoughts out,
the sounds.",ive sitting bottom swimming pool drowning thoughts sounds,9/2/2015 23:28:35,0,S6_Feeling_Bad_About_Yourself
639218187591094273,@GarnKarneval hi...,,9/2/2015 23:27:46,0,Other
639217437393747969,I need someone to talk to,talk,9/2/2015 23:24:47,0,S2_Feeling_Down
639209277136220160,Much love to my followers even tho yall don't talk to me,love followers yall talk,9/2/2015 22:52:22,0.5,S6_Feeling_Bad_About_Yourself
639204073879830528,The only thing I seem to be good at is having suicidal thoughts that might kill me one day.,thing good suicidal thoughts kill day,9/2/2015 22:31:41,0.35,S9_Suicidal_Thoughts
639203364056793092,"Fortunately, I know that I'm not worth it. In my purest form, I was never good enough for anyone.",fortunately worth purest form good,9/2/2015 22:28:52,-0.025,S2_Feeling_Down
639202459299250176,"Be with someone that doesn’t try to change you, but brings out the real you.",doesnt change brings,9/2/2015 22:25:16,0.2,S6_Feeling_Bad_About_Yourself
639202273562882049,You breath me in like air and I tried to tell you I was poison but you were too addicted to care.,breath air poison addicted care,9/2/2015 22:24:32,-0.4,S6_Feeling_Bad_About_Yourself
639202180206096384,"Another victim, another viper
I can feel sins gripping tighter
To the spirits that we die for
And I will never let it go...",victim viperi feel sins gripping tighterto spirits die forand,9/2/2015 22:24:10,0.2125,Other
639200164398407680,"cmon dude, can you please stop bother me?",cmon dude bother,9/2/2015 22:16:09,0,Other
639121959931019264,"""The world is a vampire""",vampire,9/2/2015 17:05:24,0,Other
639121516353966080,If I die right know in this fucking second no one would even care,die fucking care,9/2/2015 17:03:38,0.1428571429,S9_Suicidal_Thoughts
639121105110892544,I don't even understant myself,understant,9/2/2015 17:02:00,0,S6_Feeling_Bad_About_Yourself
638856490355412992,I guess I'm not into boys....,guess boys,9/1/2015 23:30:31,0,Other
638855032385990656,I just want to sleep forever,sleep forever,9/1/2015 23:24:43,0,S9_Suicidal_Thoughts
638854330876084225,I'M SORRY I'M SO FUCKING SORRY,fucking,9/1/2015 23:21:56,-0.5,S6_Feeling_Bad_About_Yourself
638853509262278657,I know im stupid,stupid,9/1/2015 23:18:40,-0.8,S6_Feeling_Bad_About_Yourself
638853342618329088,I'm sorry I hurted you,hurted,9/1/2015 23:18:00,-0.5,S6_Feeling_Bad_About_Yourself
638853299123421184,I want to die,die,9/1/2015 23:17:50,0,S9_Suicidal_Thoughts
638839727127437312,http://t.co/YXmHPLuLWm,,9/1/2015 22:23:54,0,Other
638839375099465728,"""Scars may fade away but never disappear my dear.""",scars fade disappear dear,9/1/2015 22:22:30,0,S9_Suicidal_Thoughts
638833383288647680,I really don't feel like existing today,feel existing,9/1/2015 21:58:42,0.2,S9_Suicidal_Thoughts
638818116147937280,I feel myself fading away,feel fading,9/1/2015 20:58:02,0,S6_Feeling_Bad_About_Yourself
638725792202100736,"Because she will fall again.
And again
And again
And again
And again
And again
And again
And again
And again....",fall againand againand againand againand againand againand againand,9/1/2015 14:51:10,0,Other
638725345814933505,Dying inside,dying,9/1/2015 14:49:24,0,S9_Suicidal_Thoughts
638724870839341056,What are you supposed to do when everything crumbles around you?,supposed crumbles,9/1/2015 14:47:30,0,S2_Feeling_Down
638724589472882688,"We're all in the same game, just different levels. Dealing with the same hell, just different devils.",game levels dealing hell devils,9/1/2015 14:46:23,-0.08,S6_Feeling_Bad_About_Yourself
638724059426111488,"- I already ate.
(I starve myself)
- Go away!
(show me you care enough to stay)",ate starve care stay,9/1/2015 14:44:17,0,S2_Feeling_Down
638723754089164800,"The person who completes suicide,dies once.Those left behind die a 1000 deaths,trying to relieve those terrible moments and undrstand...Why?",person completes suicide dies behind die 1000 deaths relieve terrible moments undrstand,9/1/2015 14:43:04,-0.4666666667,S9_Suicidal_Thoughts
638723668688936960,"-I'm just tired.
(I can't take this anymore)",tired,9/1/2015 14:42:44,-0.4,S4_lassitute
638723453252698112,"- I'm fine.
( I'm not fine please help me)",fine fine,9/1/2015 14:41:52,0.1041666667,S6_Feeling_Bad_About_Yourself
638723292937986048,"""Depression is like a war. You either win or die trying.""",depression war win die,9/1/2015 14:41:14,0.8,Other
638723060405784576,"It hurts but it's ok, I'm used to it.",hurts,9/1/2015 14:40:19,0.5,S6_Feeling_Bad_About_Yourself
638721651883003904,Maybe it's not about the ending.... maybe it's about the story...,ending story,9/1/2015 14:34:43,0,S2_Feeling_Down
638721579019595776,"Behind every kind of beautiful, there is some kind of pain.",behind kind beautiful kind pain,9/1/2015 14:34:25,0.4125,S2_Feeling_Down
638721474115825665,"To the world you may be just one 
person.
To a person you may be the
world.",person person theworld,9/1/2015 14:34:00,0,S6_Feeling_Bad_About_Yourself
638721422051934213,"When you are dreaming with a broken heart, the waking up is the hardest part.",dreaming broken heart waking hardest,9/1/2015 14:33:48,-0.4,S6_Feeling_Bad_About_Yourself
638721373192503296,Life is never easy for those who dream.,life easy dream,9/1/2015 14:33:36,-0.2166666667,S6_Feeling_Bad_About_Yourself
638721325780082688,I'm not as strong as everyone thinks i am...,strong thinks,9/1/2015 14:33:25,0.4333333333,S6_Feeling_Bad_About_Yourself
638720807959719936,"The person who completes suicide, dies once.Those left behind die a thousand deaths, trying to relive those terrible moments and understand…",person completes suicide dies behind die deaths relive terrible moments understand,9/1/2015 14:31:22,-0.4666666667,S9_Suicidal_Thoughts
638720180214996992,"""Did it hurt when you fell from Heaven?""
""No but it hurt like a bitch when I crawled up from Hell.""",hurt fell heaven hurt bitch crawled hell,9/1/2015 14:28:52,0,S2_Feeling_Down
638719839297798144,"""She paints a lovely picture, but there's a shocking twist. The paintbrush is a razor and the canvas is her wrist.""",paints lovely picture shocking twist paintbrush razor canvas wrist,9/1/2015 14:27:31,-0.25,S9_Suicidal_Thoughts
638719138354085889,Please take me anywhere but here.,,9/1/2015 14:24:44,0,S2_Feeling_Down
638718311367315456,"""I'm sorry that I'm so complicated and mess everything up.""",complicated mess,9/1/2015 14:21:26,-0.3916666667,S2_Feeling_Down
638718256543612929,"""My thoughts have destroyed me more than blades could ever do.""",thoughts destroyed blades,9/1/2015 14:21:13,0.5,S9_Suicidal_Thoughts
638718078038228993,"""I don't even want to kill myself. I just want to escape. Escape from all of this feelings and thoughts. I just want do die.""",kill escape escape feelings thoughts die,9/1/2015 14:20:31,0,S9_Suicidal_Thoughts
638717899071442944,"""You cannot save people, you can only love them.""",people love,9/1/2015 14:19:48,0.25,S2_Feeling_Down
638717814178729984,"""-Why do you want to kill yourself?
-Why don't you want to kill yourself?
-To live.
-And I want to kill myself to die.""",kill kill live kill die,9/1/2015 14:19:28,0.1363636364,S9_Suicidal_Thoughts
638703700190601216,@666suicidal666 :( thanks,,9/1/2015 13:23:23,-0.275,Other
638697350899322880,"""People don't change.Sometimes, they just forget who they really are.""",people change forget,9/1/2015 12:58:09,0.2,S6_Feeling_Bad_About_Yourself
